row_id,boardgame,release_year,min_players,max_players,min_playtime,max_playtime,minimum_age,avg_rating,num_ratings,complexity,rank_overall,owned,wishlisted,total_plays,fans,amazon_price,std_deviation,monthly_plays,previously_owned,for_trade,want_trade,categories
1047,Lanterns: The Harvest Festival,2015,2,4,30,30,8,6.861,11801,1.55,1047,20465,2116,42197,590,31.2,1.19,139,2471,444,250,Abstract Strategy
1048,River of Gold,2024,2,4,60,90,14,7.561,2720,2.43,1048,3961,2078,12605,375,,1.15,534,170,31,362,Economic; Fantasy; Travel
1049,Kingsburg (Second Edition),2017,2,5,90,120,10,7.378,3379,2.44,1049,5926,1131,7488,161,,1.2,56,921,121,217,City Building; Dice; Fantasy; Medieval
1050,The Palaces of Carrara,2012,2,4,60,60,10,7.118,4889,2.59,1050,4842,1094,16531,185,,1.19,13,1312,166,332,City Building; Economic; Renaissance
1051,Merchants of the Dark Road,2022,1,4,60,120,12,7.352,3711,3.27,1051,7875,2479,8839,695,47.58,1.39,41,1134,223,208,Exploration; Fantasy; Medieval; Transportation
1052,Marvel Dice Masters: Avengers vs. X-Men,2014,2,2,60,60,14,7.091,5700,2.3,1052,9813,684,29461,741,7.2,1.51,6,1731,520,132,Collectible Components; Comic Book / Strip; Dice; Fighting
1053,Genoa,2001,2,5,60,120,12,7.044,6245,3.07,1053,8026,1180,8148,142,34.1,1.43,3,1941,403,310,Negotiation; Renaissance
1054,Tragedy Looper,2011,2,4,120,120,13,7.182,4731,3.55,1054,9396,1529,8568,322,44.04,1.58,38,1740,418,192,Bluffing; Card Game; Deduction; Murder / Mystery
1055,Gloomhaven: Buttons & Bugs,2024,1,1,20,20,10,7.56,2871,3.29,1055,13003,1598,20500,643,19.94,1.45,743,531,147,136,Adventure; Card Game; Fantasy; Fighting; Miniatures
1056,Black Rose Wars: Rebirth,2023,1,4,90,240,14,8.446,1732,3.68,1056,4645,838,5194,2228,234.99,1.48,134,213,48,77,Card Game; Fantasy; Miniatures
1057,Tajemnicze Domostwo,2013,2,7,30,60,8,7.085,5512,1.83,1057,5410,1021,20729,285,43.99,1.45,21,1152,151,109,Deduction; Murder / Mystery
1058,Conflict of Heroes: Awakening the Bear! É?? Russia 1941-42,2008,1,4,120,120,10,7.501,3081,3,1058,4010,1016,6480,386,,1.49,1,1242,210,176,Wargame; World War II
1059,Cockroach Poker,2004,2,6,20,20,8,6.805,15355,1.1,1059,27103,2130,71607,455,53.97,1.47,545,1864,292,216,Bluffing; Card Game; Party Game
1060,Dungeons & Dragons: Castle Ravenloft Board Game,2010,1,5,60,60,12,6.98,9449,2.5,1060,17796,2309,23171,1300,73,1.44,27,2771,510,332,Adventure; Exploration; Fantasy; Fighting; Horror; Miniatures
1061,Tidal Blades: Heroes of the Reef,2020,1,4,60,90,14,7.458,3221,2.94,1061,7014,2017,7718,821,104,1.45,35,983,210,169,Fantasy
1062,Rajas of the Ganges: The Dice Charmers,2020,2,5,30,45,12,7.494,2845,2.28,1062,5874,679,22444,136,19,1.13,156,628,85,92,Dice
1063,DC Deck-Building Game,2012,2,5,45,45,15,7.043,7799,2,1063,13008,869,39129,705,,1.49,191,1477,321,110,Card Game; Comic Book / Strip
1064,Yedo: Deluxe Master Set,2020,1,5,60,90,12,7.917,1923,3.21,1064,4547,717,5206,262,199.98,1.37,19,519,80,169,Medieval
1065,Napoleon's Triumph,2007,2,2,180,180,12,7.998,1849,3.66,1065,2987,1477,3563,347,,1.73,22,567,59,403,Napoleonic; Wargame
1066,Atiwa,2022,1,4,30,120,12,7.464,2972,2.73,1066,5172,1348,11109,263,50.49,1.1,107,590,100,212,Animals; Economic; Educational; Environmental; Farming; Territory Building
1067,Primal: The Awakening,2024,1,4,60,90,14,8.604,1512,3.84,1067,3399,1751,8191,961,599.99,1.5,185,198,21,242,Fantasy; Fighting; Miniatures
1068,Lowlands,2018,2,4,50,100,12,7.38,3257,3.07,1068,5317,1850,6816,180,,1.19,16,936,128,318,Farming
1069,Adrenaline,2016,3,5,30,60,12,6.981,7075,2.37,1069,9187,1513,14657,276,59.99,1.3,33,1920,354,178,Fighting; Miniatures; Science Fiction; Video Game Theme
1070,Signorie,2015,2,4,60,120,12,7.369,3255,3.51,1070,3545,816,9851,134,,1.24,22,835,92,192,Dice; Renaissance
1071,Castles of Mad King Ludwig: Collector's Edition,2022,1,5,60,90,13,8.278,1525,2.59,1071,4387,620,5399,178,,1.16,110,125,32,125,Post-Napoleonic; Puzzle
1072,Kitchen Rush,2017,1,4,30,45,12,7.217,4183,2.17,1072,6980,1595,15748,227,,1.3,28,1036,150,212,Real-time
1073,Tinners' Trail,2008,3,4,60,90,13,7.199,4152,2.83,1073,4107,563,8369,99,,1.22,6,1036,198,156,Economic; Industry / Manufacturing
1074,Sail,2023,2,2,20,20,11,7.319,3482,2.23,1074,9411,2565,20055,567,24,1.19,1267,530,112,270,Card Game; Nautical; Pirates
1075,Santa Monica,2020,2,4,45,45,14,7.142,4792,2.14,1075,8206,1757,16248,298,93.07,1.19,98,1415,231,198,City Building; Travel
1076,Pictomania (Second Edition),2018,3,6,20,40,8,7.566,2572,1.47,1076,5013,773,9979,83,34.95,1.22,66,367,81,94,Action / Dexterity; Humor; Party Game; Real-time
1077,Orchard: 9 card solitaire game,2018,1,1,5,10,8,7.253,4025,1.19,1077,8592,1163,74663,410,19.99,1.22,587,673,92,90,Abstract Strategy; Card Game; Farming; Print & Play
1078,Fliptown,2023,1,4,30,45,12,7.754,2193,2.41,1078,5335,1661,13110,344,34.99,1.09,616,288,38,263,American West; Print & Play
1079,Zooloretto,2007,2,5,45,45,8,6.788,15528,1.86,1079,19991,1639,48752,302,40.72,1.18,78,3626,665,303,Animals
1080,Bridge,1925,4,4,60,60,12,7.457,3227,3.89,1080,2137,171,28278,183,,2.01,54,93,11,8,Card Game
1081,Lands of Galzyr,2022,1,4,60,150,14,7.966,2012,1.7,1081,4470,4039,7509,848,,1.44,62,582,55,505,Adventure; Animals; Dice; Exploration; Fantasy
1082,Summoner Wars: Alliances Master Set,2014,2,4,45,45,9,8.027,1840,2.78,1082,3573,582,3903,149,,1.45,7,561,127,111,Card Game; Fantasy; Fighting
1083,Meeple Circus,2017,2,5,45,45,8,7.019,6199,1.4,1083,10042,1553,20262,205,,1.29,84,1412,169,239,Action / Dexterity; Animals; Real-time
1084,Maharaja: The Game of Palace Building in India,2004,2,5,90,90,12,7.097,5154,3.17,1084,5945,725,7705,94,,1.29,8,1456,295,194,City Building
1085,Outfoxed!,2014,2,4,20,20,5,7.141,5193,1.1,1085,11176,1209,34992,255,32.89,1.27,257,973,126,138,Animals; Children's Game; Deduction; Dice
1086,Attika,2003,2,4,45,60,10,6.986,6673,2.36,1086,6201,1023,25500,114,,1.25,29,1602,224,235,Ancient; City Building; Territory Building
1087,Concept,2013,4,12,40,40,10,6.749,21470,1.38,1087,35900,2795,57585,488,44.99,1.39,226,3793,676,218,Deduction; Party Game; Word Game
1088,Dice Throne,2018,2,6,20,40,8,7.613,2930,2.14,1088,3791,1423,32575,468,279.99,1.57,423,301,27,80,Card Game; Dice; Fantasy; Fighting
1089,The Others,2016,2,5,90,90,14,7.294,4195,3.04,1089,8800,1956,7318,697,,1.59,8,1200,226,198,Fantasy; Fighting; Horror; Miniatures
1090,Thunder Alley,2014,2,7,90,90,10,7.29,3670,2.39,1090,4682,957,11645,282,65.9,1.49,21,907,168,249,Racing; Sports
1091,Coffee Traders,2021,2,5,120,150,12,7.706,2372,4.25,1091,4472,1426,5678,320,58,1.41,54,463,115,179,Economic; Farming; Industry / Manufacturing; Territory Building
1092,Skulls of Sedlec,2020,2,3,20,20,8,7.381,3209,1.26,1092,8616,875,28674,188,,1.06,376,365,78,109,Card Game; Print & Play; Renaissance
1093,Rolling Realms,2021,1,6,30,30,14,7.128,4701,1.98,1093,11354,1105,35412,334,25,1.29,306,969,192,104,Number; Print & Play
1094,Virgin Queen,2012,2,6,420,420,12,7.993,1839,4.44,1094,3649,1238,3225,350,72.73,1.65,19,512,58,227,Negotiation; Pike and Shot; Political; Religious; Renaissance; Wargame
1095,Snow Tails,2008,2,5,45,60,10,6.969,6546,2.05,1095,6875,1668,16830,197,,1.17,15,1822,231,348,Animals; Racing; Sports
1096,Cyclades: Legendary Edition,2024,2,6,60,90,13,8.17,1744,2.89,1096,4679,1792,3941,792,74.99,1.41,287,143,18,251,Ancient; City Building; Civilization; Fighting; Mythology; Nautical
1097,5-Minute Dungeon,2017,2,5,5,30,8,6.909,10993,1.12,1097,21834,2303,57167,565,,1.36,340,2004,351,154,Card Game; Fantasy; Fighting; Print & Play; Real-time
1098,Grove: 9 card solitaire game,2021,1,1,5,10,8,7.551,2639,1.29,1098,6714,777,49252,280,16.99,1.12,713,260,68,72,Abstract Strategy; Card Game; Farming; Print & Play
1099,Tiny Epic Quest,2017,1,4,30,60,14,6.954,7908,2.68,1099,20616,1986,16056,884,45.92,1.34,25,2748,474,182,Adventure; Exploration; Fantasy; Fighting; Video Game Theme
1100,Fit to Print,2023,1,6,15,30,10,7.327,3489,2.08,1100,8442,2027,13452,479,35.73,1.23,265,600,131,162,Abstract Strategy; Animals; Puzzle; Real-time
1101,Snow Tails,2008,2,5,45,60,10,6.968,6547,2.05,1101,6873,1671,16838,197,,1.17,7,1828,228,345,Animals; Racing; Sports
1102,The Others,2016,2,5,90,90,14,7.293,4200,3.05,1102,8798,1959,7321,698,,1.59,1,1208,228,198,Fantasy; Fighting; Horror; Miniatures
1103,Scarface 1920,2023,1,4,90,150,14,7.949,2182,3.81,1103,4089,1297,5217,563,,1.64,24,260,35,173,Economic; Mafia
1104,Sherlock Holmes Consulting Detective: The Baker Street Irregulars,2020,1,8,90,90,14,8.202,1604,2.29,1104,6187,1628,4512,209,,1.35,20,350,52,186,Deduction; Murder / Mystery; Novel-based
1105,Sabika,2022,1,4,60,120,14,7.728,2316,3.86,1105,4485,1206,7116,279,44.99,1.25,30,472,76,172,Medieval
1106,Dungeons & Dragons: Wrath of Ashardalon Board Game,2011,1,5,60,60,12,7.093,6833,2.59,1106,14798,1923,12395,971,50,1.43,6,2113,364,327,Adventure; Exploration; Fantasy; Fighting; Miniatures
1107,River Valley Glassworks,2024,1,5,25,45,8,7.293,3729,1.51,1107,7892,1549,41873,420,74,1.27,691,183,53,177,Animals; Industry / Manufacturing
1108,Virgin Queen,2012,2,6,420,420,12,7.993,1839,4.44,1108,3659,1235,3228,350,71.24,1.65,0,515,57,225,Negotiation; Pike and Shot; Political; Religious; Renaissance; Wargame
1109,Tiny Epic Quest,2017,1,4,30,60,14,6.953,7916,2.68,1109,20635,1985,16065,884,29.99,1.34,8,2755,478,182,Adventure; Exploration; Fantasy; Fighting; Video Game Theme
1110,Homesteaders,2009,2,4,60,90,14,7.185,3992,3.05,1110,4383,845,10852,168,,1.23,7,1309,246,187,American West; City Building; Economic
1111,Compile: Main 1,2024,2,2,20,30,14,7.928,1974,2.33,1111,5598,2917,9696,540,,1.29,215,143,44,304,Card Game; Science Fiction
1112,Cities,2024,2,4,45,45,14,7.381,3381,1.92,1112,6913,1535,16872,383,28.41,1.11,379,328,87,189,Abstract Strategy; City Building
1113,Fabled Fruit,2016,2,5,20,30,8,6.981,6322,1.61,1113,9550,1353,51487,206,,1.23,28,1819,266,227,Animals; Card Game
1114,Evenfall,2023,1,4,60,120,14,7.651,2379,3.08,1114,4326,2221,7409,492,37.37,1.22,91,441,76,260,Card Game; Fantasy
1115,The Castles of Burgundy: The Card Game,2016,1,4,30,60,12,6.944,7040,2.57,1115,13699,913,26222,221,,1.29,10,2956,537,115,Card Game
1116,Imperium: Horizons,2024,1,4,40,160,14,8.555,1352,4.03,1116,4309,2175,5386,650,,1.27,102,153,37,303,Card Game; Civilization
1117,Web of Power,2000,3,5,50,60,12,7.305,3611,2.31,1117,3602,666,10147,89,,1.33,4,619,100,227,Medieval; Territory Building
1118,Louis XIV,2005,2,4,75,100,12,7.038,5542,3,1118,6693,727,10371,101,,1.24,2,1713,334,154,Age of Reason; Card Game; Political
1119,Brew Crafters,2013,2,5,90,90,12,7.366,3180,3.58,1119,4885,1158,7411,270,,1.3,6,1028,177,220,Economic; Industry / Manufacturing
1120,Wasteland Express Delivery Service,2017,2,5,90,120,13,7.304,3706,2.96,1120,7839,1961,6865,426,59.95,1.4,6,1196,283,258,Science Fiction; Transportation
1121,The Grimm Forest,2018,2,4,45,60,14,7.066,6229,1.94,1121,12179,1888,14911,609,,1.4,20,1575,263,186,Animals; Fantasy
1122,Era: Medieval Age,2019,1,4,45,60,8,7.186,4320,2.27,1122,7062,1658,15193,310,,1.27,25,1001,141,264,City Building; Civilization; Dice; Medieval
1123,Kingdomino Origins,2021,2,4,20,40,8,7.469,2829,1.91,1123,6688,998,12241,146,26.6,1.1,32,586,102,109,Prehistoric; Puzzle; Territory Building
1124,"Hey, That's My Fish!",2003,2,4,20,20,8,6.701,22270,1.45,1124,29673,2063,101255,434,,1.13,89,4115,666,299,Abstract Strategy; Animals
1125,Faiyum,2020,1,5,110,140,12,7.473,2738,3.07,1125,4179,1365,7054,250,48,1.24,24,599,81,272,Ancient; City Building; Economic; Farming
1126,Ticket to Ride: London,2019,2,4,10,15,8,7.059,5479,1.34,1126,14772,588,26998,143,25.99,1.13,65,1098,203,61,Trains
1127,Gold West,2015,2,4,45,60,13,7.3,3367,2.45,1127,4011,1237,10506,187,75,1.13,15,927,139,277,American West; Economic; Territory Building
1128,Canopy,2021,1,4,30,30,8,7.265,3782,2.02,1128,9383,1828,14725,436,34.49,1.16,55,986,132,155,Animals; Card Game; Environmental
1129,Smash Up: Science Fiction Double Feature,2014,2,2,30,45,12,7.255,4138,2.25,1129,12946,615,2616,120,25.29,1.32,1,1296,251,83,Card Game; Fantasy; Horror; Humor; Mythology; Prehistoric; Science Fiction; Spies / Secret Agents
1130,Point City,2023,1,4,15,30,10,7.163,4247,1.66,1130,9864,1160,23362,256,24.93,1.09,126,609,124,113,Card Game; City Building
1131,Sniper Elite: The Board Game,2022,1,4,40,70,16,7.765,2156,2.42,1131,4557,2349,6861,345,45.15,1.26,93,406,54,363,Miniatures; Video Game Theme; Wargame; World War II
1132,Manila,2005,3,5,60,60,10,6.995,6297,2.03,1132,6768,1207,14386,219,,1.27,8,1239,113,346,Nautical; Pirates; Transportation
1133,Britannia,1986,3,5,180,300,12,7.19,4341,3.16,1133,6256,735,5528,261,,1.51,3,1082,252,134,Ancient; Civilization; Medieval; Wargame
1134,CuBirds,2018,2,5,20,20,8,6.91,8405,1.33,1134,12153,1106,124448,352,19.95,1.27,325,724,75,119,Animals; Card Game
1135,Little Town,2017,2,4,30,60,10,7.154,4589,1.95,1135,8174,1098,16614,244,12.99,1.15,33,1094,146,121,City Building; Medieval
1136,Riverboat,2017,2,4,90,90,10,7.419,2872,2.94,1136,4799,727,7556,141,19.99,1.1,9,794,158,156,Farming
1137,Cat Lady,2017,2,4,15,30,8,6.991,6814,1.38,1137,12078,1423,38327,350,23.3,1.19,65,1118,167,131,Animals; Card Game; Humor
1138,Ecos: First Continent,2019,2,6,45,75,14,7.125,4633,2.57,1138,6836,1809,14308,263,85,1.35,32,1125,174,214,Animals; Environmental; Prehistoric; Territory Building
1139,Art Society,2023,2,4,30,60,10,7.515,2926,1.85,1139,5528,2107,9183,500,40.36,1.15,105,322,50,242,Puzzle
1140,Container: 10th Anniversary Jumbo Edition!,2018,3,5,75,90,13,7.672,2173,2.93,1140,3037,1524,5114,188,,1.43,16,528,47,483,Economic; Industry / Manufacturing; Nautical; Transportation
1141,Conflict of Heroes: Awakening the Bear! É?? Operation Barbarossa 1941 (Second Edition),2012,2,4,60,180,13,7.918,1932,3.26,1141,3890,806,4815,294,,1.37,18,705,111,142,Wargame; World War II
1142,Core Worlds,2011,2,5,60,120,10,7.137,4332,2.89,1142,5374,1531,11725,303,,1.36,7,1306,255,293,Card Game; Civilization; Science Fiction; Space Exploration
1143,Rivals for Catan,2010,2,2,45,60,10,6.937,8196,2.32,1143,20429,1031,18442,393,23.99,1.39,27,2370,483,110,Card Game; City Building; Medieval; Territory Building
1144,Heroscape Master Set: Swarm of the Marro,2007,2,4,60,60,8,7.651,2433,2.27,1144,4954,333,2451,97,,1.45,0,710,153,159,Adventure; Fantasy; Fighting; Miniatures; Science Fiction
1145,Quarto,1991,2,2,20,20,8,6.9,8556,1.88,1145,14526,1267,53930,295,33,1.37,143,1342,329,125,Abstract Strategy; Children's Game
1146,Legacy: The Testament of Duke de Crecy,2013,1,4,60,60,8,7.123,4450,2.72,1146,5647,991,11173,216,,1.25,4,1669,267,176,Age of Reason; Card Game; Economic
1147,Hawaii,2011,2,5,60,60,13,7.103,4634,2.9,1147,4804,937,15939,182,,1.29,10,1158,176,211,Farming; Territory Building
1148,Flick 'em Up!,2015,2,10,30,45,7,6.844,9368,1.34,1148,16684,2734,16805,336,,1.27,18,3108,582,405,Action / Dexterity; American West; Fighting
1149,Herbaceous,2017,1,4,15,20,8,7,6130,1.21,1149,11640,1801,49066,396,32.99,1.14,45,1385,188,182,Card Game; Print & Play
1150,Pictures,2019,3,5,20,30,8,7.226,3669,1.04,1150,6253,884,14502,138,34.15,1.31,40,321,53,96,Deduction; Party Game
1151,Ascension: Storm of Souls,2011,1,4,30,30,13,7.279,3681,2.32,1151,5736,375,29149,180,,1.31,24,1003,176,64,Card Game; Fantasy
1152,Legendary: A Marvel Deck Building Game É?? Villains,2014,1,5,45,45,14,7.527,2786,2.71,1152,6340,793,6825,277,,1.44,0,711,110,193,Card Game; Comic Book / Strip
1153,Winner's Circle,2001,2,6,45,60,10,6.991,5885,1.6,1153,6123,1245,16429,139,,1.24,14,1120,148,441,Animals; Racing; Sports
1154,Summoner Wars: Phoenix Elves vs Tundra Orcs,2009,2,4,30,30,9,7.49,2694,2.29,1154,5638,229,3376,63,,1.47,1,1206,212,69,Card Game; Fantasy; Fighting
1155,Wildlands,2018,2,4,30,60,14,7.271,3698,2.24,1155,5475,1948,11343,320,61.27,1.35,8,1122,154,264,Fantasy; Fighting; Miniatures
1156,World of Warcraft: Wrath of the Lich King,2021,1,5,45,60,14,7.382,3535,2.29,1156,9542,956,7621,332,44.95,1.24,29,723,180,69,Fantasy; Video Game Theme
1157,Archaeology: The New Expedition,2016,2,5,20,30,10,7.121,4519,1.27,1157,7188,1695,20187,202,149.95,1.19,23,947,129,259,Card Game
1158,ICECOOL,2016,2,4,30,30,6,6.786,11893,1.05,1158,19907,1850,50052,349,60,1.26,70,2081,344,224,Action / Dexterity; Animals; Children's Game
1159,Age of Industry,2010,2,5,120,120,13,7.34,3074,3.35,1159,3491,826,7424,132,,1.36,8,884,137,202,Economic; Industry / Manufacturing; Transportation
1160,Linko,2014,2,5,20,20,10,6.997,5627,1.38,1160,9759,804,47309,163,,1.21,93,995,194,140,Card Game
1161,Dice Town,2009,2,5,45,45,10,6.873,8067,1.69,1161,10169,1919,24469,269,,1.26,22,1677,216,387,American West; Dice; Party Game
1162,That's Not a Hat,2023,3,8,15,15,8,7.029,5374,1.06,1162,11734,1126,44008,251,9.99,1.35,263,430,113,89,Bluffing; Card Game; Memory; Party Game
1163,Warhammer Underworlds: Shadespire,2017,2,2,30,30,12,7.591,2949,2.52,1163,4926,707,16222,310,74.95,1.53,3,733,132,97,Card Game; Collectible Components; Dice; Fantasy; Fighting; Miniatures
1164,Resist!,2022,1,1,20,40,10,7.408,2978,2.27,1164,7179,2083,12698,582,,1.26,46,1088,168,244,Card Game; Civil War; Spies / Secret Agents; Wargame
1165,World's Fair 1893,2016,2,4,35,45,10,7.148,4210,2.03,1165,7060,1072,12702,328,37.99,1.16,14,1187,218,197,Post-Napoleonic
1166,Oriflamme,2019,3,5,15,30,10,7.085,4944,1.67,1166,7919,1254,29526,223,,1.25,41,721,101,118,Card Game; Political
1167,Paper Tales,2017,2,5,30,30,12,7.018,5453,2.18,1167,7923,1812,20326,227,31,1.28,34,1570,240,257,Card Game; Fantasy
1168,Haggis,2010,2,4,45,45,13,7.038,4866,2.1,1168,7218,1040,24067,252,,1.37,33,1422,231,207,Card Game
1169,Two Rooms and a Boom,2013,6,30,7,20,8,6.988,5960,1.48,1169,10133,2598,24565,652,,1.66,35,1020,203,281,Bluffing; Card Game; Deduction; Negotiation; Party Game; Print & Play; Real-time; Spies / Secret Agents
1170,Toy Battle,2025,2,2,15,15,8,7.662,2302,1.47,1170,3438,1281,39725,311,,1.36,1785,59,13,186,Wargame
1171,Empires of the Void II,2018,2,5,90,180,13,7.455,2743,3.47,1171,5630,1723,5065,431,68.03,1.33,7,1082,189,256,Civilization; Economic; Exploration; Science Fiction; Space Exploration
1172,Irish Gauge,2014,3,5,60,60,12,7.191,3676,2.37,1172,5488,1146,9940,182,28,1.25,23,918,151,232,Economic; Trains
1173,Kelp: Shark vs Octopus,2024,2,2,40,60,10,7.632,2434,2.36,1173,7122,3465,8554,765,,1.37,131,317,63,355,Animals; Bluffing; Card Game; Dice; Environmental
1174,Mr. Jack Pocket,2010,2,2,15,15,14,6.835,8981,1.82,1174,15137,990,31359,245,,1.21,20,2168,369,137,Bluffing; Deduction; Murder / Mystery; Post-Napoleonic
1175,Explorers of the North Sea,2016,1,4,45,60,12,7.271,3446,2.13,1175,7148,1428,11561,324,59.95,1.19,23,786,91,233,Animals; Exploration; Medieval; Nautical
1176,Cottage Garden,2016,1,4,60,60,8,6.849,8697,1.89,1176,13005,2169,30175,311,,1.19,22,2685,293,295,Abstract Strategy; Farming; Puzzle
1177,Agent Avenue,2024,2,4,10,20,8,7.618,2247,1.31,1177,4542,1716,25690,298,,1.15,617,146,30,239,Animals; Bluffing; Card Game; Spies / Secret Agents
1178,The Speicherstadt,2010,2,5,45,45,8,7.015,5215,2.27,1178,5116,690,16005,188,,1.24,7,1376,170,169,Economic
1179,Alma Mater,2020,2,4,90,150,12,7.283,3385,3.75,1179,7345,1082,7750,262,19.99,1.33,30,1210,272,98,Renaissance
1180,Here I Stand: 500th Anniversary Edition,2017,2,6,180,360,14,8.458,1330,4.57,1180,3238,952,1711,287,,1.55,7,243,42,180,Negotiation; Pike and Shot; Political; Religious; Renaissance; Wargame
1181,Cosmic Encounter: 42nd Anniversary Edition,2018,3,5,60,120,14,8.144,1627,2.48,1181,3864,699,4518,185,66.59,1.49,12,272,47,87,Bluffing; Negotiation; Science Fiction; Space Exploration
1182,A Study in Emerald,2013,2,5,90,90,13,7.208,3580,3.46,1182,3790,1671,9469,384,,1.63,6,751,68,430,Bluffing; Fantasy; Horror; Murder / Mystery; Novel-based; Political; Post-Napoleonic; Spies / Secret Agents; Zombies
1183,The Fox Experiment,2023,1,4,60,60,14,7.331,3027,2.57,1183,6254,1918,9160,410,58.73,1.5,42,466,91,227,Animals; Dice
1184,Wiz-War (Eighth Edition),2012,2,4,30,60,14,7.06,5160,2.32,1184,7627,1538,12333,400,,1.44,10,1443,247,273,Fantasy; Fighting; Miniatures
1185,History of the World,1991,3,6,135,270,12,7.116,4618,2.77,1185,5878,591,6493,218,,1.51,2,863,274,139,Civilization; Ancient; Medieval; Napoleonic; Post-Napoleonic; Renaissance; Wargame; World War I
1186,Set a Watch,2019,1,4,45,80,13,7.251,3834,2.42,1186,8646,1832,9953,817,29.71,1.3,31,1202,215,214,Adventure; Card Game; Dice; Fantasy
1187,La Citt?ˇ,2000,2,5,120,120,12,7.007,5334,3.27,1187,7041,739,6053,78,,1.29,7,1782,423,197,City Building; Civilization; Renaissance; Territory Building
1188,Majesty: For the Realm,2017,2,4,20,30,7,6.924,6672,1.72,1188,8477,1117,33312,214,,1.14,23,1591,200,156,Card Game; Medieval
1189,Super Fantasy Brawl,2022,2,4,30,40,14,7.561,2758,2.26,1189,4820,801,13411,455,50.06,1.56,28,628,95,78,Fantasy; Fighting; Miniatures
1190,The Lord of the Rings,2000,2,5,60,90,12,6.733,16124,2.53,1190,27809,1283,29030,649,,1.47,15,4486,1237,182,Adventure; Fantasy; Novel-based
1191,Black Fleet,2014,3,4,60,60,14,6.991,5706,1.94,1191,8507,1545,11433,288,,1.23,9,1684,211,294,Miniatures; Nautical; Pirates; Transportation
1192,Fallout Shelter: The Board Game,2020,2,4,60,90,14,7.227,3852,2.03,1192,7588,1616,8545,260,,1.14,11,803,84,236,Video Game Theme
1193,Septima,2023,1,4,50,100,12,7.376,3223,3.68,1193,8183,2590,8253,970,20,1.43,33,900,174,233,Fantasy; Mythology
1194,Tawantinsuyu: The Inca Empire,2020,1,4,60,120,14,7.395,2955,4.11,1194,6898,1046,7699,239,,1.41,14,1010,223,138,Civilization; Economic; Renaissance
1195,"Time of Crisis: The Roman Empire in Turmoil, 235-284 AD",2017,2,4,120,180,14,7.577,2352,3.05,1195,3503,1061,7016,235,79.95,1.32,16,504,67,187,Ancient; Wargame
1196,Star Trek: Frontiers,2016,1,4,60,240,14,7.838,1945,4.34,1196,5110,2026,4217,464,80,1.44,12,777,129,362,Movies / TV / Radio theme; Science Fiction; Space Exploration
1197,Discoveries: The Journals of Lewis & Clark,2015,2,4,60,60,14,7.015,5061,2.36,1197,7193,934,14568,182,,1.16,9,1907,350,146,American West; Dice
1198,Reavers of Midgard,2019,2,4,60,120,14,7.332,3186,2.92,1198,6950,998,7661,316,39.99,1.32,17,1032,248,108,
1199,Men at Work,2018,2,5,30,45,8,7.207,3712,1.08,1199,6274,1650,15505,161,,1.24,29,706,89,258,Action / Dexterity
1200,Fauna,2008,2,6,45,60,8,7.042,4881,1.45,1200,6143,1016,17407,131,,1.24,17,846,112,175,Animals; Educational; Trivia
1201,Jump Drive,2017,2,4,10,30,13,7.001,5239,2.02,1201,7259,1347,77960,212,23.64,1.37,221,1298,229,196,Card Game; Science Fiction; Space Exploration
1202,Antike,2005,2,6,120,120,12,7.075,4734,2.99,1202,3897,953,7953,143,,1.35,3,1157,171,211,Ancient; Civilization; Fighting; Nautical; Territory Building
1203,The Castles of Tuscany,2020,2,4,45,60,10,7.21,3645,2.23,1203,6948,1251,14065,228,25,1.17,28,1094,193,147,Industry / Manufacturing; Renaissance; Territory Building
1204,Tsuro,2005,2,8,15,20,8,6.667,29916,1.22,1204,45414,4443,147838,1079,34.95,1.33,176,4221,727,375,Fantasy
1205,Ticket to Ride: New York,2018,2,4,10,15,8,6.891,7459,1.27,1205,17263,591,34400,174,27.99,1.17,44,1662,258,82,Trains
1206,Summoner Wars: Guild Dwarves vs Cave Goblins,2009,2,4,30,30,9,7.547,2416,2.23,1206,5209,211,2555,55,,1.45,1,1115,206,57,Card Game; Fantasy; Fighting
1207,Ghost Fightin' Treasure Hunters,2013,2,4,30,30,8,7.143,4226,1.62,1207,8962,1495,19087,256,77.41,1.22,34,941,160,161,Adventure; Children's Game; Fantasy; Horror
1208,Sentinels of the Multiverse: Definitive Edition,2022,1,5,30,60,8,8.16,1615,2.81,1208,4498,674,11259,270,79.99,1.48,39,262,79,82,Card Game; Comic Book / Strip; Fighting
1209,Flick of Faith,2019,2,4,15,40,8,7.332,3117,1.22,1209,5655,815,18544,166,,1.27,59,507,70,94,Action / Dexterity; Mythology
1210,Valley of the Kings,2014,2,4,45,45,14,7.006,4975,2.18,1210,7443,1222,13924,184,,1.2,13,1538,248,170,Ancient; Card Game; Mythology; Religious
1211,Star Wars: The Queen's Gambit,2000,2,4,120,120,12,7.588,2290,2.48,1211,2683,1555,3955,180,,1.44,6,454,42,765,Fighting; Miniatures; Movies / TV / Radio theme; Science Fiction; Wargame
1212,Caf??,2020,1,4,20,45,8,7.181,3905,2.06,1212,7588,1323,20628,269,37.84,1.19,125,863,133,165,Card Game; Economic; Farming; Industry / Manufacturing
1213,Legendary Encounters: A Predator Deck Building Game,2015,1,5,45,45,17,7.42,2833,2.68,1213,6006,829,7343,268,,1.33,19,904,160,160,Card Game; Movies / TV / Radio theme; Science Fiction
1214,NMBR 9,2017,1,4,20,20,8,6.837,8046,1.22,1214,10807,1268,70443,181,,1.24,115,1549,244,148,Abstract Strategy; Number; Puzzle
1215,Firenze,2010,2,4,60,60,12,7.221,3358,2.55,1215,3833,1106,10941,128,,1.17,12,916,98,338,Economic; Renaissance
1216,Mint Works,2017,1,4,10,20,13,6.894,6929,1.73,1216,14573,1322,37601,351,,1.22,18,1589,345,134,Card Game; Industry / Manufacturing
1217,Chronicles of Crime: 1900,2021,1,4,60,90,12,7.9,2211,1.93,1217,9636,726,4337,244,,1.35,14,834,176,116,Adventure; Deduction; Murder / Mystery; Puzzle
1218,Metropolys,2008,2,4,30,60,8,7.056,4389,2.2,1218,4169,896,12509,116,,1.2,11,1134,123,265,Territory Building
1219,Insider,2016,4,8,15,15,9,7.03,4795,1.11,1219,8700,1962,37850,196,22.99,1.3,80,729,112,193,Bluffing; Deduction; Party Game; Word Game
1220,Automobiles,2016,2,5,45,75,10,7.188,3517,2.21,1220,3044,957,22157,145,,1.22,18,759,88,267,Racing; Sports; Transportation
1221,Star Wars: Legion,2018,2,2,120,180,14,8.006,2011,3.51,1221,5444,714,8753,370,149.99,1.51,13,352,81,99,Miniatures; Movies / TV / Radio theme; Science Fiction; Wargame
1222,Conspiracy: Abyss Universe,2019,2,4,30,30,8,7.196,3636,1.79,1222,6416,750,33148,171,57.11,1.15,72,528,109,104,Card Game; Fantasy; Nautical
1223,Black Forest,2024,1,4,60,120,14,7.598,2212,3.17,1223,4420,2603,7285,614,59.95,1.21,105,281,57,325,City Building; Economic; Industry / Manufacturing; Medieval
1224,Fields of Green,2016,2,4,45,45,12,7.119,3991,2.6,1224,6477,981,11312,219,39.99,1.21,10,1467,261,163,Card Game; City Building; Farming
