row_id,boardgame,release_year,min_players,max_players,min_playtime,max_playtime,minimum_age,avg_rating,num_ratings,complexity,rank_overall,owned,wishlisted,total_plays,fans,amazon_price,std_deviation,monthly_plays,previously_owned,for_trade,want_trade,categories
1,Brass: Birmingham,2018,2,4,60,120,14,8.575,53548,3.87,1,76201,20334,152594,6726,69.95,1.42,1208,3420,278,1758,Age of Reason; Economic; Industry / Manufacturing; Post-Napoleonic; Trains; Transportation
2,Pandemic Legacy: Season 1,2015,2,4,60,60,13,8.512,56071,2.83,2,87378,14478,301410,4221,76.97,1.6,387,12927,509,799,Environmental; Medical
3,Ark Nova,2021,1,4,90,150,14,8.539,54528,3.79,3,79476,16121,528979,7465,71.81,1.39,7019,3234,415,1073,Animals; Card Game; Economic; Environmental
4,Gloomhaven,2017,1,4,60,120,14,8.557,65443,3.92,4,101913,21597,542336,10780,,1.74,1206,8682,1210,1164,Adventure; Exploration; Fantasy; Fighting; Miniatures
5,Twilight Imperium: Fourth Edition,2017,3,6,240,480,14,8.572,26686,4.34,5,32012,12449,49484,3546,172.29,1.64,363,1738,212,1074,Civilization; Economic; Exploration; Negotiation; Political; Science Fiction; Space Exploration; Territory Building; Wargame
6,Dune: Imperium,2020,1,4,60,120,14,8.418,53995,3.07,6,72571,14792,210763,6400,51.98,1.28,1589,4236,492,1074,Movies / TV / Radio theme; Novel-based; Political; Science Fiction
7,Terraforming Mars,2016,1,5,120,120,12,8.347,107994,3.27,7,151245,25730,740148,11977,79.99,1.43,3635,8129,809,1890,Civilization; Economic; Environmental; Industry / Manufacturing; Science Fiction; Space Exploration; Territory Building
8,War of the Ring: Second Edition,2011,2,4,150,240,13,8.548,23752,4.22,8,39262,12412,42493,3419,94.71,1.48,296,2581,281,1395,Fantasy; Fighting; Novel-based; Territory Building; Wargame
9,Star Wars: Rebellion,2016,2,4,180,240,14,8.418,34995,3.75,9,54891,14452,55353,3801,109.99,1.36,208,3487,393,1475,Civil War; Movies / TV / Radio theme; Science Fiction; Space Exploration; Wargame
10,Dune: Imperium É?? Uprising,2023,1,6,60,120,13,8.707,13487,3.51,10,21384,6566,39729,2323,56.4,1.33,1099,439,67,828,Movies / TV / Radio theme; Novel-based; Science Fiction
11,Spirit Island,2017,1,4,90,120,13,8.339,58873,4.08,11,90410,23844,390307,7768,64.99,1.52,3294,6607,632,1791,Environmental; Fantasy; Mythology; Territory Building
12,Gloomhaven: Jaws of the Lion,2020,1,4,30,120,14,8.382,38651,3.64,12,83848,8865,194704,4120,64.95,1.48,1064,6956,1066,442,Adventure; Exploration; Fantasy; Fighting; Miniatures
13,Gaia Project,2017,1,4,60,150,12,8.359,29894,4.4,13,36748,12470,125607,2973,,1.41,753,3121,356,1366,Civilization; Economic; Science Fiction; Space Exploration; Territory Building
14,Twilight Struggle,2005,2,2,120,180,13,8.235,50906,3.61,14,71760,12794,133314,5372,64.5,1.58,255,6918,1101,1296,Modern Warfare; Political; Wargame
15,Through the Ages: A New Story of Civilization,2015,2,4,120,120,14,8.261,33740,4.44,15,39022,9899,144956,2581,79.99,1.53,527,4703,548,954,Card Game; Civilization; Economic
16,The Castles of Burgundy,2011,2,4,30,90,12,8.152,66796,2.97,16,81487,13425,410557,4643,399.99,1.25,1746,8808,928,1102,Animals; Dice; Medieval; Territory Building
17,Great Western Trail,2016,2,4,75,150,12,8.163,42836,3.7,17,46377,9971,153049,2608,42.74,1.32,342,6054,642,1119,American West; Animals; Economic
18,Eclipse: Second Dawn for the Galaxy,2020,2,6,60,200,14,8.409,16024,3.65,18,20606,8588,32784,2239,225,1.39,225,1184,124,949,Civilization; Exploration; Science Fiction; Space Exploration; Territory Building; Wargame
19,Scythe,2016,1,5,90,115,14,8.115,89793,3.45,19,122965,25439,328201,10384,84,1.45,1135,7870,963,1797,Economic; Fighting; Science Fiction; Territory Building
20,Brass: Lancashire,2007,2,4,60,120,14,8.198,26390,3.85,20,34563,6241,80344,2181,69.6,1.36,219,4229,570,955,Economic; Educational; Industry / Manufacturing; Post-Napoleonic; Transportation
21,7 Wonders Duel,2015,2,2,30,30,10,8.084,103726,2.23,21,174404,11713,604553,6429,,1.2,2740,9336,1343,857,Ancient; Card Game; City Building; Civilization; Economic
22,Frosthaven,2022,1,4,90,180,14,8.773,9036,4.41,22,22261,6188,102087,2546,198.95,1.93,1410,851,218,328,Adventure; Exploration; Fantasy; Fighting; Miniatures
23,Nemesis,2018,1,5,90,180,12,8.254,34821,3.48,23,47097,14803,82874,5471,138.63,1.52,524,2832,220,1220,Adventure; Horror; Miniatures; Science Fiction
24,Clank! Legacy: Acquisitions Incorporated,2019,2,4,90,120,13,8.511,10679,2.74,24,18480,6536,62938,1079,100,1.44,295,1665,127,653,Adventure; Fantasy
25,A Feast for Odin,2016,1,4,30,120,12,8.166,31679,3.86,25,41417,15786,123275,2728,,1.38,643,3485,300,1974,Animals; Economic; Farming; Industry / Manufacturing; Medieval; Puzzle
26,Concordia,2013,2,5,100,100,13,8.084,43420,2.99,26,49571,12179,144417,2698,52.47,1.21,446,4019,410,1530,Ancient; Economic; Nautical
27,Great Western Trail: Second Edition,2021,1,4,75,150,12,8.284,16100,3.71,27,23201,4971,59591,1289,65.99,1.29,458,1611,191,519,American West; Animals; Economic
28,Lost Ruins of Arnak,2020,1,4,30,120,12,8.071,51953,2.93,28,78658,14978,285051,5124,59.99,1.26,2563,4064,475,1117,Adventure; Card Game; Exploration; Fantasy
29,Arkham Horror: The Card Game,2016,1,2,60,120,14,8.126,46246,3.56,29,81160,11164,347171,6156,48.99,1.55,1485,8800,1116,717,Adventure; Card Game; Collectible Components; Exploration; Horror; Novel-based
30,Root,2018,2,4,60,90,14,8.07,59387,3.83,30,93130,22851,214776,8055,47.2,1.48,1388,6339,683,1603,Animals; Fantasy; Negotiation; Territory Building; Wargame
31,The Lord of the Rings: Duel for Middle-earth,2024,2,2,30,45,10,8.375,12887,2.06,31,28052,5816,50401,2304,39.99,1.11,2006,487,103,575,Card Game; Fantasy; Novel-based
32,Too Many Bones,2017,1,4,60,120,12,8.316,15886,3.87,32,24285,12583,80318,3572,154.8,1.53,482,2040,174,1437,Adventure; Dice; Fantasy; Fighting
33,Terra Mystica,2012,2,5,60,150,12,8.039,49937,3.98,33,53949,14169,170491,4212,79.7,1.47,278,6531,909,1517,Civilization; Economic; Fantasy; Territory Building
34,Sky Team,2023,2,2,20,20,10,8.154,23570,2.04,34,48582,9275,235694,2895,30.19,1.14,6082,1135,192,719,Aviation / Flight; Dice
35,Wingspan,2019,1,5,40,70,10,8.014,105678,2.47,35,167120,20695,768920,10360,55,1.37,4382,7484,881,1278,Animals; Card Game; Educational
36,Orl??ans,2014,2,5,90,90,12,8.048,34120,3.01,36,41482,9237,115970,2132,,1.17,557,3598,338,1377,Medieval; Religious; Travel
37,Slay the Spire: The Board Game,2024,1,4,30,150,12,8.69,8131,2.91,37,13729,7264,45535,2239,113.59,1.3,1563,397,38,832,Adventure; Card Game; Fantasy; Fighting; Video Game Theme
38,SETI: Search for Extraterrestrial Intelligence,2024,1,4,40,160,14,8.395,11877,3.78,38,19511,8241,41581,2853,,1.27,2181,406,50,815,Science Fiction; Space Exploration
39,Mage Knight Board Game,2011,1,4,60,240,14,8.08,34503,4.37,39,47220,12716,79847,5114,101.54,1.64,168,7594,1027,1172,Adventure; Exploration; Fantasy; Fighting
40,Barrage,2019,1,4,90,180,14,8.145,20213,4.12,40,24527,7094,72799,1848,199.99,1.44,466,1930,169,899,Economic; Environmental; Industry / Manufacturing
41,The Crew: Mission Deep Sea,2021,2,5,20,20,10,8.081,22685,2.04,41,45507,6384,272858,1451,14.95,1.31,2560,1509,289,405,Adventure; Card Game; Mythology; Nautical
42,Everdell,2018,1,4,40,80,10,7.997,63498,2.83,42,96790,22060,254249,7459,,1.3,1351,6591,635,1414,Animals; Card Game; City Building; Fantasy
43,Viticulture Essential Edition,2015,1,6,45,90,13,7.969,52887,2.89,43,74393,13118,191305,3412,52,1.27,693,5234,478,1427,Economic; Farming
44,Hegemony: Lead Your Class to Victory,2023,2,4,90,180,14,8.418,10200,4.23,44,16412,6263,21437,2253,75.04,1.4,296,862,114,623,Economic; Educational; Negotiation; Political
45,Heat: Pedal to the Metal,2022,1,6,30,60,10,8.014,34442,2.2,45,50365,13709,202523,4271,60,1.33,2680,2076,230,1364,Racing; Sports
46,Marvel Champions: The Card Game,2019,1,4,45,90,14,8.113,26377,2.95,46,45408,6084,586345,3516,48.99,1.47,4544,3808,555,525,Card Game; Collectible Components; Comic Book / Strip; Fighting
47,Crokinole,1876,2,4,30,30,8,8.055,20033,1.22,47,19314,6710,240174,1055,108.99,1.6,1707,727,71,819,Action / Dexterity
48,Kanban EV,2020,1,4,60,180,14,8.39,9280,4.3,48,15305,5935,23415,2007,119.99,1.31,196,1023,61,839,Economic; Industry / Manufacturing
49,Food Chain Magnate,2015,2,5,120,240,14,8.042,22035,4.19,49,26813,10444,56312,1934,,1.61,205,2727,327,1531,Economic; Industry / Manufacturing
50,Underwater Cities,2018,1,4,80,150,12,8.045,21742,3.58,50,28492,8272,83875,1562,59.43,1.21,403,2654,239,1074,Card Game; City Building; Industry / Manufacturing; Nautical; Science Fiction
51,Pax Pamir: Second Edition,2019,1,5,45,120,13,8.141,16378,3.85,51,23256,6638,66228,1903,71.84,1.54,489,1802,215,900,Economic; Educational; Negotiation; Political; Post-Napoleonic; Spies / Secret Agents
52,Puerto Rico,2002,3,5,90,150,12,7.903,73039,3.27,52,83746,9942,203385,4442,49.1,1.39,269,9546,1488,957,City Building; Economic; Farming
53,Cthulhu: Death May Die,2019,1,5,90,120,14,8.189,15461,2.49,53,26267,7619,65624,2498,,1.39,559,1567,121,723,Fantasy; Fighting; Horror; Miniatures; Novel-based
54,Cascadia,2021,1,4,30,45,10,7.913,49310,1.85,54,82170,14360,313960,4763,37.77,1.13,3281,3000,355,1008,Animals; Environmental
55,On Mars,2020,1,4,90,150,14,8.17,14075,4.63,55,21873,8235,37172,2963,111.99,1.51,212,2129,179,862,City Building; Economic; Exploration; Science Fiction; Space Exploration; Territory Building
56,Pandemic Legacy: Season 0,2020,2,4,45,60,14,8.355,8931,3.17,56,19749,4083,65426,580,71.99,1.56,368,2807,84,310,Medical; Spies / Secret Agents
57,Caverna: The Cave Farmers,2013,1,7,30,210,12,7.931,36490,3.77,57,47234,11841,91194,2509,,1.34,331,4873,565,1623,Animals; Economic; Fantasy; Farming
58,Anachrony,2017,1,4,30,120,15,8.053,20568,4,58,25855,8691,54734,3366,,1.39,272,2963,250,986,Economic; Science Fiction
59,Age of Innovation,2023,1,5,40,200,14,8.519,7097,4.26,59,9709,4068,23254,1142,89.99,1.29,392,440,64,480,Civilization; Economic; Fantasy; Territory Building
60,Blood Rage,2015,2,4,60,90,14,7.908,50172,2.88,60,60107,13905,111089,4037,89.99,1.42,331,5385,550,1434,Fantasy; Fighting; Mythology
61,Agricola,2007,1,5,30,150,12,7.864,75296,3.63,61,88532,12759,287734,6825,57.19,1.55,431,10031,1418,1136,Animals; Economic; Farming
62,Oathsworn: Into the Deepwood,2022,1,4,30,90,14,8.822,6184,3.69,62,12019,5920,36018,2597,349.99,1.52,312,857,126,613,Adventure; Card Game; Dice; Exploration; Fantasy; Fighting; Miniatures; Mythology; Puzzle
63,Lisboa,2017,1,4,60,120,12,8.174,12245,4.57,63,18136,6563,31222,1438,119.99,1.46,147,1712,137,1049,City Building; Economic; Industry / Manufacturing; Political
64,Sleeping Gods,2021,1,4,60,120,13,8.13,14625,3.25,64,33398,16367,46850,3445,82.95,1.47,427,3387,359,1216,Adventure; Exploration; Fantasy; Fighting; Nautical
65,Obsession,2018,1,4,30,90,14,8.091,16030,3.1,65,22657,8544,86938,2249,,1.34,943,1544,105,1283,Post-Napoleonic
66,Grand Austria Hotel,2015,2,4,60,120,12,7.958,23513,3.2,66,30464,6886,116284,1559,58.99,1.25,684,2893,179,1263,Economic
67,Pandemic Legacy: Season 2,2017,2,4,60,60,14,8.019,17815,3.25,67,34046,4775,128707,809,79.99,1.69,226,5768,249,305,Environmental; Exploration; Medical; Science Fiction
68,Clank!: Catacombs,2022,2,4,45,90,13,8.25,10545,2.5,68,18807,5632,40883,1259,66,1.16,909,677,54,758,Adventure; Fantasy
69,Mansions of Madness: Second Edition,2016,1,5,120,180,14,7.925,38945,2.7,69,63158,13456,100296,3796,87.99,1.51,313,5522,686,1066,Adventure; Exploration; Fantasy; Fighting; Horror; Miniatures; Murder / Mystery; Mythology; Novel-based; Puzzle
70,Tzolk'in: The Mayan Calendar,2012,2,4,90,90,13,7.85,41310,3.66,70,48929,9529,131173,2277,59.95,1.27,373,4690,423,1364,Ancient; Civilization; Economic; Farming; Mythology
71,Power Grid,2004,2,6,120,120,12,7.801,68031,3.25,71,84393,12104,162101,3958,41.57,1.34,319,7625,1120,1374,Economic; Industry / Manufacturing
72,Harmonies,2024,1,4,30,45,10,8.026,19928,2,72,33087,8135,195924,3109,34.99,1.19,6690,698,100,747,Abstract Strategy; Animals; Environmental
73,Quacks,2018,2,4,45,45,10,7.808,55795,1.94,73,88074,12458,278155,3397,90,1.25,1319,4206,443,1240,Fantasy; Medieval
74,Ticket to Ride Legacy: Legends of the West,2023,2,5,20,90,10,8.669,5283,2.58,74,12888,3587,61837,759,110.58,1.31,710,610,40,346,Trains
75,Clans of Caledonia,2017,1,4,30,120,12,7.935,21632,3.47,75,22649,7316,78459,1562,,1.19,308,3103,180,1104,Economic; Farming
76,Paladins of the West Kingdom,2019,1,4,90,120,12,7.964,19579,3.71,76,31576,6224,59250,1617,52.44,1.25,237,2733,309,692,Medieval
77,The Gallerist,2015,1,4,60,150,13,8.012,15837,4.22,77,21422,6646,38541,1389,103.99,1.34,122,2555,216,1200,Economic
78,Le Havre,2008,1,5,30,150,12,7.838,33111,3.71,78,38937,9953,89248,2135,72.99,1.41,205,5016,420,1743,City Building; Economic; Industry / Manufacturing; Nautical
79,Maracaibo,2019,1,4,30,120,12,7.969,17965,3.91,79,24187,6562,71304,1415,73.74,1.3,277,3134,396,751,Economic; Exploration; Nautical; Pirates
80,Star Wars: Imperial Assault,2014,2,5,60,120,14,7.958,25476,3.3,80,44199,7448,96859,3397,89.97,1.42,211,4584,753,797,Adventure; Exploration; Fighting; Miniatures; Movies / TV / Radio theme; Science Fiction; Wargame
81,Android: Netrunner,2012,2,2,45,45,14,7.89,30934,3.41,81,46837,5837,353165,4393,,1.66,498,7898,1384,588,Bluffing; Card Game; Collectible Components; Science Fiction
82,The White Castle,2023,1,4,80,80,12,7.994,17762,3.04,82,31395,6505,100767,2584,,1.2,2539,1196,144,740,Dice; Economic
83,Agricola (Revised Edition),2016,1,4,30,120,12,7.955,20081,3.44,83,27711,3920,66565,1235,55.25,1.42,435,2809,307,434,Animals; Economic; Farming
84,Mechs vs. Minions,2016,2,4,60,120,14,7.96,18015,2.46,84,24817,8322,67984,1405,,1.35,130,3233,365,1071,Fantasy; Fighting; Miniatures; Video Game Theme
85,The Crew: The Quest for Planet Nine,2019,2,5,20,20,10,7.771,46164,1.96,85,88492,5952,620042,1935,15.95,1.32,2491,6523,1277,309,Card Game; Science Fiction; Space Exploration
86,Kingdom Death: Monster,2015,1,4,60,180,17,8.479,10138,4.27,86,13472,7352,56569,3358,979.98,2.01,188,967,106,727,Adventure; Dice; Fantasy; Fighting; Horror; Mature / Adult; Miniatures; Mythology
87,Blood on the Clocktower,2022,6,21,30,120,15,8.371,8921,3.05,87,8905,5944,103136,1787,,1.91,2038,318,52,505,Bluffing; Deduction; Murder / Mystery; Party Game
88,Race for the Galaxy,2007,2,4,30,60,12,7.739,57711,2.99,88,72392,11309,761848,4286,26.92,1.46,2095,8639,1277,1066,Card Game; Civilization; Economic; Science Fiction; Space Exploration
89,Great Western Trail: New Zealand,2023,1,4,75,150,12,8.501,5701,4,89,10237,2262,17510,555,59.99,1.23,295,426,56,418,Animals; Economic
90,Azul,2017,2,4,30,45,8,7.726,101682,1.77,90,169222,15351,817173,5937,34.97,1.17,4440,7370,990,948,Abstract Strategy; Renaissance
91,Revive,2022,1,4,90,120,14,8.098,10959,3.45,91,16311,6289,47081,1548,79.99,1.21,1077,1050,135,772,Civilization; Industry / Manufacturing; Science Fiction
92,Five Tribes: The Djinns of Naqala,2014,2,4,40,80,13,7.767,43952,2.84,92,57801,11403,137345,2320,,1.27,438,5048,555,1256,Arabian; Fantasy; Mythology
93,Darwin's Journey,2023,1,4,60,120,14,8.116,10467,3.9,93,14954,4691,43869,1571,51,1.29,691,853,94,501,Exploration; Travel
94,Clank!: A Deck-Building Adventure,2016,2,4,30,60,12,7.768,45619,2.23,94,59767,12191,169240,2884,,1.21,808,6085,603,1144,Adventure; Fantasy
95,Fields of Arle,2014,1,2,60,120,13,8.031,11925,3.85,95,18103,6258,37500,928,84.99,1.29,150,2436,202,1075,Economic; Farming; Industry / Manufacturing
96,Wingspan Asia,2022,1,2,40,70,10,8.236,8661,2.67,96,30323,3403,25598,741,45,1.26,360,630,93,394,Animals; Economic; Educational
97,Eclipse: New Dawn for the Galaxy,2011,2,6,60,180,14,7.822,28843,3.71,97,28233,6825,55581,3055,,1.51,36,5177,898,792,Civilization; Fighting; Science Fiction; Space Exploration; Territory Building; Wargame
98,Aeon's End,2016,1,4,60,60,14,7.876,22879,2.81,98,33312,8407,130005,2455,51.17,1.37,708,4019,406,642,Card Game; Fantasy; Fighting; Science Fiction
99,El Grande,1995,2,5,60,120,12,7.765,31599,2.94,99,33299,7400,63315,1399,49.99,1.32,273,3834,494,1408,Medieval
100,Lords of Waterdeep,2012,2,5,60,120,12,7.731,58007,2.45,100,72986,11120,190133,4147,,1.27,475,5912,714,1210,City Building; Fantasy
101,SCOUT,2019,2,5,20,20,9,7.813,23798,1.38,101,46123,5174,167615,1425,22.99,1.18,2788,1000,218,455,Card Game
102,Teotihuacan: City of Gods,2018,1,4,90,120,14,7.845,21364,3.77,102,28034,5720,80807,1445,56.97,1.31,251,3403,479,625,Ancient; City Building; Economic
103,Concordia Venus,2018,2,6,60,120,12,8.264,7022,3.01,103,11809,3031,18463,453,64.38,1.19,132,704,88,512,Ancient; Economic
104,Final Girl,2021,1,1,20,60,14,8.242,9298,2.74,105,23719,3979,52752,1677,26.75,1.36,618,1373,215,331,Card Game; Fantasy; Horror
105,Beyond the Sun,2020,2,4,60,120,14,7.878,16615,3.14,104,18631,6562,67587,1109,67.84,1.17,339,1809,228,800,Civilization; Science Fiction; Space Exploration
106,Voidfall,2023,1,4,90,240,15,8.532,5654,4.59,106,11088,6131,20136,2220,120,1.49,323,679,83,575,Civilization; Economic; Science Fiction; Space Exploration
107,Through the Ages: A Story of Civilization,2006,2,4,120,120,12,7.824,19728,4.18,107,18339,4276,75234,1526,,1.7,82,5145,928,550,Civilization; Economic
108,Dominant Species,2010,2,6,120,240,14,7.804,22033,4.04,108,24222,7359,37674,1606,76.16,1.52,87,3468,474,1039,Animals; Environmental; Prehistoric
109,7 Wonders,2010,2,7,30,30,10,7.669,109771,2.31,109,150655,14516,639978,7500,46.05,1.28,1261,12581,1959,977,Ancient; Card Game; City Building; Civilization; Economic
110,The Search for Planet X,2020,1,4,60,75,13,7.913,14531,2.43,110,25182,6408,57788,1072,40.67,1.23,359,1958,271,586,Deduction; Puzzle; Space Exploration
111,Robinson Crusoe: Adventures on the Cursed Island,2012,1,4,60,120,14,7.731,45682,3.83,111,73781,13284,125987,4363,48.95,1.46,311,9961,1557,1215,Adventure; Exploration; Fighting; Novel-based; Territory Building
112,The Voyages of Marco Polo,2015,2,4,40,100,12,7.769,25819,3.18,112,27482,4930,101052,1267,,1.27,199,4178,426,845,Dice; Economic; Medieval; Travel
113,Arcs,2024,2,4,60,120,14,8.066,12182,3.42,113,21044,9234,33907,3620,56.46,1.76,1741,594,153,691,Science Fiction; Space Exploration; Wargame
114,Splendor Duel,2022,2,2,30,30,10,7.892,16392,2.01,114,32314,4024,100413,1138,32.99,1.12,1600,998,130,370,Card Game; Economic; Renaissance
115,Decrypto,2018,3,8,15,45,12,7.767,25669,1.83,115,42355,7040,90272,1271,24.99,1.26,485,2335,365,495,Deduction; Party Game; Spies / Secret Agents; Word Game
116,Trickerion: Legends of Illusion,2015,2,4,60,180,14,7.97,12040,4.26,116,16869,4329,26281,1338,65,1.44,127,2392,238,611,Post-Napoleonic
117,Inis,2016,2,4,60,90,14,7.82,22097,2.95,117,28325,9202,50242,1769,70.39,1.47,190,3428,379,1243,Ancient; Card Game; Exploration; Mythology; Wargame
118,Battlestar Galactica: The Board Game,2008,3,6,120,180,14,7.729,37256,3.25,118,40124,6840,84947,3631,,1.6,126,5652,772,860,Bluffing; Deduction; Movies / TV / Radio theme; Political; Science Fiction; Space Exploration; Spies / Secret Agents
119,Carnegie,2022,1,4,90,120,12,7.982,11008,3.81,119,15254,3654,41867,1381,56.62,1.21,224,1281,187,512,Economic; Industry / Manufacturing; Post-Napoleonic
120,Dwellings of Eldervale,2020,1,5,60,150,14,8.125,8757,3.25,120,11777,7029,25430,1775,99.89,1.47,263,1273,139,782,Economic; Fantasy; Fighting
121,The Quest for El Dorado,2017,2,4,30,60,10,7.707,30116,1.94,121,48936,8788,117507,1705,,1.1,857,3544,434,1103,Adventure; Exploration; Racing
122,Architects of the West Kingdom,2018,1,5,60,80,12,7.715,31434,2.76,122,43054,7507,115813,2122,52.5,1.19,424,4096,451,764,City Building; Economic; Medieval
123,Tainted Grail: The Fall of Avalon,2019,1,4,60,120,14,8.046,13542,3.36,123,27128,6579,66946,3053,102.25,1.77,320,3295,415,514,Adventure; Exploration; Fantasy; Mature / Adult; Medieval; Mythology; Travel
124,Ra,1999,2,5,45,60,12,7.674,29298,2.31,124,34770,8385,117900,1474,224.99,1.33,555,3397,405,1331,Ancient; Mythology
125,Keyflower,2012,2,6,90,120,12,7.715,24047,3.34,125,27598,6619,65198,1262,58.37,1.32,122,3976,437,1139,City Building; Economic; Renaissance; Territory Building; Transportation
126,Nemesis: Lockdown,2022,1,5,90,180,12,8.282,7409,3.91,126,18256,2901,15344,1229,131.85,1.44,251,1179,148,267,Adventure; Exploration; Horror; Miniatures; Science Fiction
127,Tigris & Euphrates,1997,2,4,60,120,14,7.701,29482,3.48,127,32007,7937,75537,1407,,1.49,137,5237,584,1553,Abstract Strategy; Ancient; Civilization; Territory Building
128,Raiders of the North Sea,2015,2,4,60,80,12,7.725,25718,2.57,128,34028,7225,82570,1907,81.77,1.18,302,3210,322,912,Medieval; Nautical
129,Dominion: Intrigue,2009,2,6,30,30,13,7.689,34342,2.41,129,50551,3204,108058,1204,33.89,1.35,126,5311,640,423,Card Game; Medieval
130,Caylus,2005,2,5,60,150,12,7.708,29656,3.79,130,29363,5442,69921,1394,124.99,1.47,54,4815,590,822,City Building; Economic; Medieval
131,Lorenzo il Magnifico,2016,2,4,60,120,12,7.834,14810,3.29,131,17391,3157,46008,793,42.5,1.23,205,2392,240,536,Renaissance
132,Eldritch Horror,2013,1,8,120,240,14,7.744,38144,3.32,132,58371,9306,103322,4435,59.95,1.55,253,5842,847,693,Adventure; Fighting; Horror; Novel-based; Travel
133,Troyes,2010,1,4,90,90,12,7.708,24496,3.38,133,28303,5866,78629,1480,,1.32,149,4228,394,1049,Dice; Economic; Medieval
134,Wyrmspan,2024,1,5,90,90,14,7.989,11976,2.81,134,26078,5752,47916,2190,65,1.33,820,641,116,417,Animals; Card Game; Fantasy
135,Mombasa,2015,2,4,75,150,12,7.84,13678,3.89,135,15151,3514,28961,606,,1.27,48,2746,236,652,Economic; Post-Napoleonic
136,The Lord of the Rings: Journeys in Middle-Earth,2019,1,5,60,120,14,7.898,17742,2.69,136,31939,7957,114541,2567,104.98,1.51,486,3017,327,642,Adventure; Exploration; Fantasy; Fighting; Novel-based
137,Age of Steam,2002,1,6,120,120,13,7.862,12184,3.86,137,13619,3228,46595,786,87.99,1.59,304,1843,256,562,Economic; Post-Napoleonic; Trains; Transportation
138,Wonderland's War,2022,2,5,45,125,13,8.054,9289,3.04,138,15061,6461,25270,1737,,1.41,266,891,80,745,Fantasy; Novel-based
139,Patchwork,2014,2,2,15,30,8,7.585,71267,1.6,139,116594,9870,415362,2806,32.08,1.17,1939,6717,829,752,Abstract Strategy; Economic; Puzzle
140,Dominion,2008,2,4,30,30,13,7.598,94566,2.35,140,126854,10377,863239,7470,39.56,1.41,1766,13115,2138,663,Card Game; Medieval
141,Trajan,2011,2,4,60,120,12,7.749,18486,3.63,141,21773,4793,53405,1117,,1.34,126,3292,346,950,Ancient
142,Twilight Imperium: Third Edition,2005,3,6,180,240,14,7.786,19460,4.26,142,20925,4365,26133,2161,159.99,1.72,3,3945,760,597,Civilization; Negotiation; Political; Science Fiction; Space Exploration; Wargame
143,Aeon's End: War Eternal,2017,1,4,60,60,14,8.239,6365,2.93,143,14285,1430,22879,511,42.33,1.29,172,1452,201,211,Card Game; Fantasy; Fighting; Science Fiction
144,Russian Railroads,2013,2,4,120,120,13,7.726,18594,3.4,144,16744,3824,69135,761,,1.3,106,3344,283,736,Industry / Manufacturing; Trains
145,Arkham Horror: The Card Game É?? Revised Core Set,2021,1,4,45,180,14,8.612,4515,3.76,145,10994,1499,27990,724,47.96,1.4,528,543,78,164,Adventure; Card Game; Collectible Components; Exploration; Fantasy; Horror; Novel-based
146,Hansa Teutonica,2009,2,5,45,90,12,7.74,16689,3.09,146,13988,3645,50560,877,54.14,1.38,154,2270,246,658,Medieval
147,Vinhos: Deluxe Edition,2016,1,4,90,180,12,8.07,7591,4,147,13223,3531,17456,706,95.99,1.26,82,1421,134,680,Economic; Industry / Manufacturing
148,Rising Sun,2018,3,5,90,120,14,7.759,22605,3.3,148,28748,7745,36776,2272,82.99,1.61,91,3168,354,728,Bluffing; Fantasy; Mythology; Negotiation; Wargame
149,ISS Vanguard,2022,1,4,90,120,13,8.438,6219,3.67,149,16376,5097,37755,2232,159,1.59,536,1198,234,373,Adventure; Exploration; Science Fiction; Space Exploration
150,The 7th Continent,2017,1,4,5,1000,14,7.752,22939,2.9,150,38471,11093,73863,4126,,1.71,156,5811,1124,951,Adventure; Card Game; Exploration; Science Fiction
151,Yokohama,2016,2,4,90,90,14,7.798,13094,3.28,151,18053,3777,45548,774,,1.16,208,2079,327,585,Economic
152,Forbidden Stars,2015,2,4,120,180,14,7.979,9746,3.84,152,13905,4198,17004,1163,,1.47,60,1938,223,770,Bluffing; Fighting; Science Fiction; Wargame
153,Iberia,2016,2,5,45,45,8,7.878,11459,2.6,153,21018,3719,30353,622,53.01,1.19,105,2015,288,449,Medical; Post-Napoleonic; Trains
154,Clank! In! Space!: A Deck-Building Adventure,2017,2,4,45,90,12,7.769,15557,2.58,154,22653,3642,47035,721,93.94,1.21,157,2696,311,587,Science Fiction
155,Just One,2018,3,7,20,60,8,7.599,32382,1.03,155,55545,5678,233090,1116,,1.21,1477,1778,308,356,Deduction; Party Game; Word Game
156,Codenames,2015,2,8,15,15,10,7.532,99421,1.26,157,170102,7596,632713,3241,19.94,1.3,1844,7937,1426,352,Card Game; Deduction; Party Game; Spies / Secret Agents; Word Game
157,Nucleum,2023,1,4,60,150,14,8.126,7010,4.18,156,12089,3875,23748,1170,,1.27,375,654,114,488,Economic; Industry / Manufacturing; Science Fiction
158,Endeavor: Deep Sea,2024,1,4,60,120,10,8.224,5956,2.9,158,9560,4732,26190,1195,,1.12,1441,328,28,586,Environmental; Exploration; Nautical
159,Champions of Midgard,2015,2,4,60,90,10,7.71,18357,2.62,159,25820,5310,44863,1053,49.99,1.26,139,2689,333,722,Adventure; Dice; Fantasy; Fighting; Medieval; Mythology
160,Rajas of the Ganges,2017,2,4,45,75,12,7.725,15382,2.9,161,20512,3934,63142,746,44.75,1.13,232,2268,196,685,Dice; Economic; Renaissance; Territory Building
161,Hadrian's Wall,2021,1,6,30,60,12,7.903,9728,3.17,160,16488,4577,64937,997,49.61,1.26,495,1846,212,505,Ancient; City Building
162,Tyrants of the Underdark,2016,2,4,60,60,14,7.913,10213,2.54,162,11813,3415,33149,821,44.5,1.22,164,1027,115,462,Fantasy; Fighting
163,PARKS,2019,1,5,30,60,10,7.636,29100,2.12,163,51342,10504,103516,2569,,1.22,498,3114,416,790,Animals; Economic; Environmental; Travel
164,Roll for the Galaxy,2014,2,5,45,45,13,7.574,32983,2.78,164,40150,8048,192506,1575,47.92,1.34,381,5153,721,1086,Civilization; Dice; Economic; Science Fiction; Space Exploration
