row_id,boardgame,release_year,min_players,max_players,min_playtime,max_playtime,minimum_age,avg_rating,num_ratings,complexity,rank_overall,owned,wishlisted,total_plays,fans,amazon_price,std_deviation,monthly_plays,previously_owned,for_trade,want_trade,categories
510,Fresco,2010,2,4,60,60,10,7.243,13441,2.64,510,16554,2386,27201,456,,1.15,29,3544,547,424,Renaissance
511,Space Hulk (Third Edition),2009,2,2,60,60,12,7.533,7202,2.78,511,10300,1585,10666,1113,,1.79,2,1400,233,361,Fighting; Miniatures; Science Fiction; Wargame
512,Kutn?≠ Hora: The City of Silver,2023,2,4,60,120,13,7.773,4669,3.33,512,7406,2322,14355,712,56,1.25,241,567,91,284,City Building; Economic; Medieval
513,Flash Point: Fire Rescue,2011,2,6,45,45,10,7.15,24996,2.2,513,40064,4521,88957,1403,,1.26,188,5843,1052,466,Adventure
514,Commands & Colors: Napoleonics,2010,2,2,90,90,14,8.052,3449,2.75,514,6218,1404,16423,581,,1.39,28,855,90,280,Napoleonic; Wargame
515,Sherlock Holmes Consulting Detective: Jack the Ripper & West End Adventures,2016,1,8,60,120,10,7.562,6350,2.22,515,17966,3275,13183,339,57.99,1.48,31,2081,311,355,Deduction; Murder / Mystery; Novel-based; Post-Napoleonic; Puzzle; Spies / Secret Agents
516,Nippon,2015,2,4,60,120,12,7.623,5151,3.76,516,4924,1694,15306,286,,1.22,40,1036,95,416,Economic; Industry / Manufacturing
517,Black Orchestra,2016,1,5,90,90,14,7.496,7061,2.42,517,11945,3147,16871,642,60,1.28,86,1623,196,458,Spies / Secret Agents; World War II
518,Macao,2009,2,4,50,100,12,7.407,7594,3.13,518,6888,2276,27638,341,,1.34,39,1815,102,739,Dice; Nautical
519,PitchCar,1995,2,8,30,30,6,7.271,11428,1.12,519,12517,3985,57994,358,,1.35,128,1383,179,1003,Action / Dexterity; Children's Game; Party Game; Racing; Sports
520,Lord of the Rings: The Confrontation,2005,2,2,30,30,14,7.504,6669,2.19,520,8179,1957,22136,361,,1.34,41,1542,180,372,Adventure; Bluffing; Deduction; Fantasy; Movies / TV / Radio theme; Novel-based
521,Kingsburg,2007,2,5,90,90,13,7.169,19985,2.42,521,18486,3329,58238,713,,1.23,57,3415,396,681,City Building; Dice; Fantasy; Medieval
522,Unmatched: Little Red Riding Hood vs. Beowulf,2020,2,2,20,20,9,8.087,3363,2,522,10730,667,4555,212,,1.2,44,614,83,124,Card Game; Fantasy; Fighting; Mythology; Novel-based
523,Stockpile,2015,2,5,45,45,13,7.43,7557,2.12,523,8001,2619,22730,419,,1.26,44,1243,142,545,Economic
524,MicroMacro: Crime City É?? Full House,2021,1,4,15,45,10,7.661,4881,1.17,524,15386,951,32249,185,26.45,1.16,176,1333,197,135,Deduction; Murder / Mystery
525,Clash of Cultures,2012,2,4,180,240,14,7.569,5885,3.6,525,6406,2351,12389,523,,1.42,9,1856,286,363,Ancient; City Building; Civilization; Economic; Exploration; Territory Building
526,Mice and Mystics,2012,1,4,60,90,7,7.213,20217,2.73,526,41423,8291,52241,2279,71.99,1.42,95,6053,914,940,Adventure; Animals; Exploration; Fantasy; Fighting; Miniatures
527,Reign of Cthulhu,2016,2,4,40,40,14,7.363,10777,2.16,527,20925,2680,26663,794,39.99,1.24,79,1986,298,274,Horror; Novel-based
528,Trekking Through History,2022,1,4,30,60,10,7.55,5967,1.74,528,11835,3316,23337,580,49.9,1.12,261,795,119,305,Adventure; Educational
529,Mandala,2019,2,2,20,20,10,7.464,6787,1.78,529,11195,2273,41869,316,32.99,1.16,246,1183,155,314,Abstract Strategy; Card Game
530,High Society,1995,3,5,15,30,10,7.191,15485,1.48,530,23105,3677,74157,595,19.12,1.24,435,2072,377,430,Card Game
531,Thunderstone Quest,2018,2,4,60,90,14,7.74,4691,2.86,531,11513,2132,18089,576,,1.41,71,1328,302,263,Card Game; Fantasy
532,Claustrophobia,2009,2,2,45,45,14,7.469,7137,2.48,532,9671,3079,17808,775,,1.37,3,2275,400,466,Adventure; Exploration; Fantasy; Fighting; Horror; Miniatures
533,Horizons of Spirit Island,2022,1,3,90,120,14,8.15,2944,3.52,533,11255,1325,7350,381,,1.38,83,629,179,121,Age of Reason; Environmental; Fantasy; Fighting; Mythology; Renaissance; Territory Building
534,Dawn of the Zeds (Third Edition),2016,1,5,90,120,14,8.155,3009,3.79,534,7010,2284,11099,583,,1.35,19,864,108,320,Fantasy; Horror; Wargame; Zombies
535,Unmatched Adventures: Tales to Amaze,2023,1,4,20,60,9,7.991,3595,2.27,535,10543,1687,14440,553,59.95,1.39,211,452,88,215,Card Game; Fantasy; Fighting; Mythology; Novel-based
536,The Manhattan Project,2012,2,5,120,120,13,7.314,10067,2.96,536,12587,2574,20948,481,,1.26,22,2720,426,459,Aviation / Flight; Economic; Industry / Manufacturing; World War II
537,Bohnanza,1997,2,7,45,45,12,7.074,49610,1.67,537,79114,3849,173922,1408,19.99,1.31,635,5843,1109,403,Card Game; Farming; Negotiation
538,Dune,1979,2,6,60,180,12,7.583,5964,3.45,538,6845,2320,7114,681,,1.7,0,1253,205,524,Bluffing; Fighting; Negotiation; Novel-based; Political; Science Fiction
539,Heroscape Master Set: Rise of the Valkyrie,2004,2,4,90,90,8,7.454,8375,2.3,539,13291,1021,30410,651,,1.56,54,2109,543,217,Adventure; Fantasy; Fighting; Miniatures; Science Fiction
540,No Thanks!,2004,3,7,20,20,8,7.08,29382,1.13,541,44013,3622,264356,673,,1.2,1287,2479,407,388,Card Game
541,Lancaster,2011,2,5,60,60,10,7.387,7775,3,541,8510,1775,16055,313,,1.19,24,1940,284,406,Medieval
542,Colt Express,2014,2,6,40,40,10,7.096,34215,1.83,542,49402,4505,109928,1205,37.66,1.25,326,5480,795,420,American West; Fighting; Trains
543,Advanced Squad Leader,1985,2,2,120,480,14,8.011,3907,4.74,543,6555,1014,21888,942,,2.06,57,873,121,128,Wargame; World War II
544,Fantastic Factories,2019,1,5,45,60,14,7.422,7513,2.23,544,13492,2499,35370,613,53.45,1.16,213,1553,262,308,Card Game; Dice; Industry / Manufacturing
545,Citadels,2016,2,8,30,60,10,7.241,16142,2.06,545,30037,3212,32059,836,32.99,1.27,212,2497,406,189,Bluffing; Card Game; City Building; Medieval
546,Wondrous Creatures,2024,1,4,40,80,14,8.077,3128,3.02,546,6730,4859,12138,1639,65,1.18,887,204,26,619,Fantasy
547,Fire in the Lake,2014,1,4,180,180,0,8.064,3208,4.17,552,8051,2268,5753,616,74.81,1.46,14,922,134,390,Civil War; Modern Warfare; Political; Vietnam War; Wargame
548,Daybreak,2023,1,4,60,120,10,7.684,4824,2.85,548,8802,3522,36405,749,54.99,1.39,832,428,73,377,Card Game; Economic; Educational; Environmental
549,Middara: Unintentional Malum É?? Act 1,2019,1,4,60,60,15,8.547,2706,4.14,549,6541,2728,20972,1824,,1.7,104,598,97,285,Adventure; Exploration; Fantasy; Fighting; Miniatures
550,Quadropolis,2016,2,4,30,60,8,7.218,13365,2.2,550,18596,2780,42152,408,,1.1,57,3189,586,409,City Building; Environmental
551,Knarr,2023,2,4,30,30,10,7.482,6485,1.93,551,10506,2623,50059,585,34.61,1.08,739,545,94,369,Card Game
552,Hadara,2019,2,5,45,60,10,7.389,7829,2.21,552,9312,2151,37070,325,,1.14,136,1204,123,358,City Building; Civilization
553,A Few Acres of Snow,2011,2,2,60,90,14,7.371,8063,3.03,553,9422,3055,22658,614,,1.49,20,2616,298,629,Age of Reason; American Indian Wars; Card Game; Territory Building; Wargame
554,Glen More,2010,2,5,60,60,13,7.291,9421,2.67,554,8525,1976,33018,366,,1.15,28,2357,231,530,City Building; Economic; Farming
555,Pipeline,2019,2,4,60,120,12,7.566,5425,3.9,555,7796,2488,16161,444,,1.45,58,1345,171,403,Economic; Industry / Manufacturing
556,Through the Desert,1998,2,5,45,45,10,7.162,15592,2.17,556,19258,3364,43971,460,,1.22,269,3257,456,710,Abstract Strategy; Animals; Arabian
557,Zombie Kidz Evolution,2018,2,4,15,15,7,7.588,5788,1.37,557,12444,1377,79853,379,24.99,1.3,350,911,101,135,Children's Game; Fighting; Horror; Zombies
558,Trio,2021,3,6,15,15,6,7.387,8584,1.05,558,17986,1811,167268,514,14.99,1.34,5062,365,82,185,Animals; Card Game
559,Undaunted: North Africa,2020,2,2,45,60,14,7.766,4369,2.31,559,13250,1817,12848,413,38.73,1.27,74,1373,197,279,Wargame; World War II
560,Black Rose Wars,2019,2,4,90,90,14,7.914,4190,3.44,560,7121,1759,9702,3591,129.99,1.55,20,822,111,147,Bluffing; Fantasy; Miniatures; Renaissance
561,Imperial Settlers: Empires of the North,2019,1,4,45,90,10,7.399,7803,2.81,561,13561,3110,28488,522,39.95,1.34,61,2512,356,308,Ancient; Card Game; City Building; Civilization; Exploration; Nautical
562,Mystic Vale,2016,2,4,45,45,14,7.24,12380,2.26,562,17364,2676,67102,558,,1.32,100,2464,405,289,Card Game; Fantasy
563,Scholars of the South Tigris,2023,1,4,60,90,12,8.041,3048,4.1,563,7601,1453,12255,404,55,1.32,282,388,76,200,Arabian; Medieval
564,Citadels,2000,2,8,20,60,10,7.056,56308,2.05,564,77592,3640,127489,2019,32.99,1.27,201,8523,1612,328,Bluffing; Card Game; City Building; Deduction; Fantasy; Medieval
565,Point Salad,2019,2,6,15,30,10,7.112,21886,1.15,565,37195,2931,169406,672,23.67,1.13,1219,2662,421,307,Card Game
566,Stuffed Fables,2018,2,4,60,90,7,7.424,7962,2.47,566,22042,4799,27402,864,79.99,1.34,110,2415,404,440,Adventure; Animals; Exploration; Miniatures
567,Friday,2011,1,1,25,25,13,7.114,22535,2.15,567,40346,3179,146060,1199,18.99,1.24,504,5900,1049,284,Adventure; Card Game; Fighting; Novel-based; Pirates; Print & Play
568,Shadows over Camelot,2005,3,7,60,90,10,7.1,28240,2.57,568,35384,7278,53640,1234,,1.4,61,5440,816,1043,Adventure; Bluffing; Deduction; Fantasy; Medieval; Mythology
569,Aquatica,2019,1,4,30,60,12,7.364,7739,2.31,569,11649,3807,26768,567,46.14,1.2,216,1675,184,427,Card Game; Fantasy; Nautical
570,Canvas,2021,1,5,30,30,10,7.21,14858,1.72,570,29375,4347,61024,2010,29.99,1.25,411,2186,303,393,Abstract Strategy; Card Game; Puzzle
571,Skymines,2022,1,4,75,150,12,7.955,3248,3.9,571,7102,1973,8474,404,49.51,1.24,63,698,141,303,Economic; Science Fiction
572,Lords of Vegas,2010,2,4,60,90,12,7.355,7945,2.34,572,10056,3184,22988,372,,1.42,45,1412,163,719,City Building; Dice; Economic; Negotiation
573,Potion Explosion,2015,2,4,30,45,8,7.121,21143,1.78,573,32274,3982,154403,824,39.94,1.2,714,2750,321,465,Fantasy; Puzzle
574,Ezra and Nehemiah,2024,1,4,90,120,13,8.208,2686,3.83,574,5512,2026,8413,755,49.41,1.22,230,237,24,326,Ancient; City Building; Religious
575,Amun-Re,2003,3,5,90,90,12,7.284,9502,3.03,575,10690,1666,26429,234,39.95,1.22,15,2158,365,403,Ancient; Economic
576,Hanabi,2010,2,5,25,25,8,7.033,51017,1.69,576,87205,4554,313404,1575,14.99,1.41,1008,7007,1545,294,Card Game; Deduction; Memory
577,EXIT: The Game É?? Dead Man on the Orient Express,2017,1,4,60,120,12,7.546,5371,2.67,577,10661,689,5513,105,14.99,1.39,16,5033,152,69,Deduction; Murder / Mystery; Puzzle; Real-time
578,Aeon Trespass: Odyssey,2022,1,4,90,90,12,9.013,2574,4.75,578,5283,2383,17140,2469,599.99,1.72,293,428,58,227,Adventure; Ancient; Civilization; Dice; Exploration; Fantasy; Fighting; Medieval; Miniatures; Mythology; Nautical; Science Fiction; Travel
579,Hitster,2022,2,10,30,30,16,7.598,5117,1.01,579,10708,721,57048,237,44.9,1.39,1747,210,25,60,Card Game; Music; Party Game; Print & Play; Trivia
580,Junk Art,2016,2,6,30,30,8,7.361,8037,1.2,580,11960,3504,28992,328,,1.25,71,1397,208,525,Action / Dexterity; Party Game
581,Amerigo,2013,2,4,90,90,10,7.436,6363,2.97,581,7928,1466,17247,274,,1.23,40,1529,234,314,Nautical; Renaissance
582,BattleLore,2006,2,2,60,60,10,7.35,9417,2.77,582,11279,1687,26866,624,,1.42,11,2583,598,290,Fantasy; Medieval; Miniatures; Wargame
583,Betrayal Legacy,2018,3,5,45,90,12,7.664,5190,2.9,583,12027,3205,27038,476,164,1.79,86,1080,96,272,Adventure; Exploration; Horror; Miniatures
584,Pandemic: The Cure,2014,2,5,30,30,8,7.236,10982,2.06,584,17654,2502,56966,439,49.99,1.23,86,2424,380,337,Dice; Environmental; Medical
585,Deus,2014,2,4,60,90,14,7.269,9541,2.83,585,11528,2205,32904,370,30,1.21,73,2287,342,359,Civilization; Mythology
586,Forbidden Desert,2013,2,5,45,45,10,7.065,32208,2.04,586,57220,5646,71565,1227,59.99,1.19,115,6248,1176,441,Adventure; Fantasy; Science Fiction
587,Regicide,2020,1,4,10,30,10,7.408,7421,1.96,587,12837,2549,79856,793,17.49,1.25,1048,537,75,240,Card Game; Fantasy; Fighting
588,Sheriff of Nottingham,2014,3,5,60,60,14,7.054,37146,1.66,588,55874,6498,69922,1275,74.99,1.31,120,6949,1218,522,Bluffing; Card Game; Humor; Medieval; Negotiation; Novel-based; Party Game
589,Next Station: London,2022,1,4,25,30,8,7.433,6493,1.48,589,11465,1407,105015,340,17.99,1.11,942,483,62,148,City Building; Trains
590,Mansions of Madness,2011,2,5,120,180,13,7.255,13908,3.24,590,20270,2990,20900,1813,87.99,1.56,9,3299,395,306,Adventure; Exploration; Fantasy; Fighting; Horror; Miniatures; Murder / Mystery; Puzzle
591,Splendor: Marvel,2020,2,4,30,30,10,7.567,5782,1.82,591,13472,1013,36814,329,,1.18,260,703,130,114,Card Game; Comic Book / Strip; Economic
592,QE,2019,3,5,45,45,8,7.356,7243,1.54,592,11568,2408,23435,302,44,1.23,129,1077,161,414,Economic
593,Thurn and Taxis,2006,2,4,60,60,10,7.091,20571,2.26,593,23864,2238,84934,509,,1.18,153,4021,526,466,Post-Napoleonic; Transportation
594,Descent: Journeys in the Dark,2005,2,5,120,240,13,7.276,11845,3.35,594,14581,1690,22250,1132,189.99,1.52,16,2672,520,266,Adventure; Exploration; Fantasy; Fighting; Miniatures
595,CATAN,1995,3,4,60,120,10,7.091,136478,2.29,595,226927,7681,412125,7915,,1.5,1467,15719,2317,524,Economic; Negotiation
596,Alhambra,2003,2,6,45,60,8,7.034,34826,2.1,596,44417,4134,131092,970,,1.19,339,6083,965,469,City Building; Medieval
597,Oceans,2020,2,4,60,90,12,7.41,7280,2.85,597,13435,3516,20487,685,54.99,1.36,47,1620,282,312,Animals; Card Game; Educational; Environmental; Prehistoric
598,Blood Bowl (Third Edition),1994,2,2,180,180,12,7.553,5682,2.99,598,6881,559,11609,370,,1.59,2,976,112,128,Fantasy; Fighting; Miniatures; Sports
599,Imhotep,2016,2,4,40,40,10,7.128,16467,2.01,599,22902,3110,53099,546,,1.14,138,3310,525,360,Ancient; Transportation
600,Risk Legacy,2011,3,5,60,60,13,7.35,8757,2.58,600,16195,2717,29433,784,163.99,1.65,32,1937,247,288,Science Fiction; Wargame
601,The Gang,2024,3,6,20,20,10,7.592,4805,1.59,601,8649,1859,56132,408,14.95,1.31,3613,203,60,210,Card Game; Party Game
602,Charterstone,2017,1,6,45,75,14,7.186,15121,2.85,602,26646,4919,93446,1185,80,1.68,135,4305,597,364,City Building; Economic; Medieval
603,Railroad Ink: Deep Blue Edition,2018,1,6,20,30,8,7.159,14198,1.45,603,22739,3132,152404,542,22.21,1.19,741,2099,301,271,Dice; Trains
604,Unfathomable,2021,3,6,120,240,14,7.477,6562,3.12,604,14160,3903,12924,777,75.84,1.46,126,1013,176,289,Bluffing; Deduction; Fantasy; Horror; Novel-based
605,Port Royal,2014,2,5,20,50,8,7.11,18571,1.62,605,27632,2094,143343,619,23.99,1.2,450,3241,449,268,Card Game; Economic; Nautical; Pirates
606,Dinosaur Island: Rawr 'n Write,2021,1,4,30,45,10,7.683,4290,2.83,606,10795,1426,17700,345,27.99,1.17,92,1013,173,143,Animals; Dice; Science Fiction
607,Argent: The Consortium,2015,2,5,60,150,10,7.612,4609,3.77,607,6550,1760,9551,586,,1.5,34,936,184,277,Fantasy; Political
608,Raptor,2015,2,2,30,30,9,7.225,10672,2.07,608,15827,3600,32756,435,38.99,1.2,64,2977,413,473,Animals; Fighting; Science Fiction
609,Shadows of Brimstone: City of the Ancients,2014,1,4,120,120,12,7.954,4037,3.38,609,7739,2896,15244,1477,,1.66,19,987,135,362,Adventure; American West; Exploration; Fantasy; Fighting; Horror; Miniatures
610,Lacrimosa,2022,1,4,90,90,14,7.642,4491,3.17,610,8225,2076,12595,587,75.99,1.13,117,846,138,282,Music
611,Ingenious,2004,1,4,30,45,8,7.1,17723,1.91,611,23009,2241,92794,432,39.87,1.19,232,2853,609,305,Abstract Strategy
612,Escape Plan,2019,1,5,60,120,12,7.489,5631,3.68,612,9350,2382,12498,1134,,1.39,30,1614,222,413,Adventure
613,"Labyrinth: The War on Terror, 2001 É?? ?",2010,1,2,180,180,12,7.568,5128,3.69,613,10307,2083,12518,729,66.63,1.54,27,1917,305,342,Modern Warfare; Political; Wargame
614,Star Wars: X-Wing (Second Edition),2018,2,2,30,45,14,8.026,3283,3.09,614,7157,530,23236,334,67.99,1.54,44,460,82,76,Aviation / Flight; Bluffing; Collectible Components; Miniatures; Movies / TV / Radio theme; Science Fiction; Wargame
615,Nova Luna,2019,1,4,30,60,8,7.262,9596,1.87,615,13969,2187,90213,416,,1.18,602,1471,155,278,Abstract Strategy; Puzzle
616,Las Vegas,2012,2,5,30,30,8,7.173,12020,1.17,616,14880,1498,90577,332,,1.23,265,1366,169,348,Dice
617,Etherfields,2020,1,4,90,180,12,7.876,4405,3.57,617,12543,3101,29319,1434,199.99,1.87,192,1287,275,206,Adventure; Exploration; Fantasy; Miniatures
618,1775: Rebellion,2013,2,4,60,120,10,7.635,4404,2.33,618,5997,1980,9601,362,80,1.23,16,953,156,409,Age of Reason; American Revolutionary War; Wargame
619,Fleet: The Dice Game,2018,1,4,30,45,8,7.626,4356,2.51,619,7439,2025,24663,569,36.99,1.15,135,807,100,325,Dice; Nautical
620,TZAAR,2007,2,2,30,60,13,7.667,4060,2.49,620,6267,1730,19149,226,34.88,1.31,37,567,70,340,Abstract Strategy
621,Pirates of Maracaibo,2023,1,4,40,100,12,7.935,3110,2.83,621,5189,2275,15884,473,49.95,1.07,609,243,31,351,Adventure; Exploration; Nautical; Pirates
622,Small World Underground,2011,2,5,30,90,8,7.224,11334,2.59,622,19748,2058,13321,481,,1.27,19,2696,401,350,Fantasy; Fighting; Territory Building
623,1846: The Race for the Midwest,2005,3,5,120,240,14,7.89,3122,4,623,4762,852,19822,203,63.85,1.39,66,610,115,220,Economic; Trains
624,Unmatched Game System,2019,2,4,20,40,9,8.235,2556,1.97,624,2683,480,48144,397,,1.47,857,129,10,36,Card Game; Fantasy; Fighting; Game System
625,Barcelona,2023,1,4,60,90,14,7.73,3857,3.37,625,6532,1992,13416,481,,1.23,226,503,85,282,City Building
626,Runebound (Third Edition),2015,2,4,120,180,14,7.476,6501,2.71,626,10798,2199,13075,779,,1.4,36,1776,254,225,Adventure; Exploration; Fantasy; Fighting
627,Love Letter: Premium Edition,2016,2,8,20,30,8,7.433,6302,1.3,627,11206,1175,25010,252,,1.38,75,749,93,158,Card Game; Deduction
628,Blackout: Hong Kong,2018,1,4,75,150,14,7.402,6269,3.47,628,10107,1501,19057,334,61.97,1.26,33,2061,384,197,Economic; Exploration
629,Discworld: Ankh-Morpork,2011,2,4,60,60,11,7.256,10758,2.21,629,12978,2680,25595,793,,1.38,35,1736,142,560,Bluffing; Card Game; City Building; Deduction; Fantasy; Novel-based
630,Blood Bowl: Living Rulebook,2004,2,2,120,120,12,7.851,3438,3.17,630,3080,359,15159,352,,1.71,1,310,18,39,Collectible Components; Expansion for Base-game; Fantasy; Fighting; Miniatures; Sports
631,Camel Up,2014,2,8,20,30,8,7.032,28463,1.5,631,36670,3246,103196,848,28.99,1.24,236,4302,466,407,Animals; Arabian; Dice; Racing
632,Freedom: The Underground Railroad,2013,1,4,60,120,13,7.575,4592,2.9,632,7110,2719,10883,368,,1.23,14,1422,161,631,American Civil War; Economic; Educational; Political
633,Wabash Cannonball,2007,2,6,30,60,12,7.252,8560,2.78,633,9177,1282,26647,318,38.47,1.35,43,2220,310,307,Economic; Post-Napoleonic; Trains; Transportation
634,RoboRally,1994,2,8,45,120,12,7.048,24264,2.43,634,28089,2800,53659,942,,1.55,60,3845,708,489,Maze; Miniatures; Racing; Science Fiction
635,Jamaica,2007,2,6,30,60,8,7.061,21593,1.66,635,31735,4945,58239,908,39.95,1.25,198,3866,536,677,Nautical; Pirates; Racing
636,The Grizzled,2015,2,5,30,30,14,7.12,15301,1.98,636,24740,2859,61702,635,13.73,1.3,110,3407,709,295,Card Game; World War I
637,Galaxy Trucker (Second Edition),2021,2,4,20,30,8,7.42,6125,2.28,637,13871,2026,22490,375,39.99,1.28,251,1230,162,155,Adventure; Aviation / Flight; Dice; Humor; Real-time; Science Fiction; Space Exploration; Transportation
638,Detective: City of Angels,2019,1,5,30,150,14,7.88,3273,2.38,638,8292,3469,11658,523,134.6,1.39,93,745,156,408,Murder / Mystery
639,Sushi Go!,2013,2,5,15,15,8,6.989,50322,1.16,639,93064,3078,266414,1488,11.99,1.16,880,7360,1229,181,Card Game; Party Game
640,Libertalia,2012,2,6,40,60,14,7.107,14583,2.23,640,15162,3527,37005,534,,1.28,40,3036,412,595,Card Game; Pirates
641,Airlines Europe,2011,2,5,75,75,10,7.301,7540,2.43,641,8353,2067,18353,263,,1.17,16,1844,219,511,Aviation / Flight; Economic
642,Valeria: Card Kingdoms,2016,1,5,30,45,13,7.437,6214,1.96,642,10305,1679,29536,626,35,1.26,71,1282,202,205,Card Game; Dice; Fantasy
643,First Class: All Aboard the Orient Express!,2016,2,4,40,80,14,7.41,5872,2.8,643,7598,1319,22975,238,,1.14,33,1523,197,281,Card Game; Trains
644,Karuba,2015,2,4,30,40,8,7.166,11578,1.42,644,16928,2706,64654,371,39.99,1.1,155,2168,281,391,Exploration; Puzzle
645,Elysium,2015,2,4,60,60,14,7.192,10036,2.77,645,14046,2238,22770,454,,1.21,35,2821,509,299,Ancient; Card Game; Mythology
646,Fromage,2024,1,4,30,45,14,7.688,3942,2.37,646,5896,3211,26339,817,50.35,1.18,795,237,43,506,Economic; Farming
647,Legends of Andor,2012,2,4,60,90,10,7.093,20276,2.76,647,36170,4317,54436,1334,39.99,1.48,107,6219,904,434,Adventure; Fantasy; Fighting; Puzzle
648,Last Will,2011,2,5,45,75,14,7.164,10797,2.72,648,12611,2761,26298,362,49.95,1.18,55,3003,351,561,Card Game; Economic; Humor
649,Life of the Amazonia,2023,1,4,60,150,14,8.126,2612,2.84,649,5015,2437,10448,469,73,1.18,346,194,25,387,Animals; Puzzle
650,London,2010,2,4,90,90,13,7.325,6647,2.89,650,6019,1197,19791,241,,1.26,15,1604,220,246,City Building; Economic
651,The Fox in the Forest,2017,2,2,30,30,10,7.068,17421,1.59,651,36793,3795,58310,715,15.99,1.24,334,3641,631,303,Animals; Card Game; Fantasy
652,Atlantis Rising (Second Edition),2019,1,7,60,120,10,7.497,5097,2.46,652,9597,3351,10967,453,74.99,1.3,30,1200,230,423,Ancient; Civilization; Dice; Fantasy; Mythology; Prehistoric; Science Fiction
653,Warp's Edge,2020,1,1,30,45,10,7.676,4065,2.4,653,10077,2300,23109,571,30.93,1.18,125,1246,201,227,Science Fiction
654,Euphoria: Build a Better Dystopia,2013,2,6,60,60,13,7.171,11248,3.12,654,15247,2798,29435,844,69.94,1.4,51,2968,441,479,Science Fiction
655,One Night Ultimate Werewolf,2014,3,10,10,10,8,7.04,29792,1.38,655,56454,3488,220773,1164,24.95,1.61,674,3885,961,216,Bluffing; Card Game; Deduction; Horror; Party Game
656,Unmatched: Jurassic Park É?? InGen vs Raptors,2020,2,2,20,40,14,8.116,2740,1.97,656,8493,934,3531,235,,1.2,17,453,65,160,Animals; Card Game; Fantasy; Fighting; Movies / TV / Radio theme
657,Vikings,2007,2,4,60,60,13,7.241,8634,2.54,657,8445,1789,39667,285,,1.2,36,1619,166,521,Economic; Medieval; Nautical; Territory Building
658,DVONN,2001,2,2,30,30,9,7.444,5597,2.65,658,7543,1452,22853,231,36.37,1.34,58,859,136,300,Abstract Strategy
659,Broom Service,2015,2,5,30,75,10,7.167,11074,2.4,659,17453,2344,27114,357,,1.27,91,2741,393,472,Fantasy
660,Sentinels of the Multiverse,2011,2,5,30,60,8,7.136,16317,2.51,660,22988,2100,95736,1576,,1.69,107,4047,1119,215,Card Game; Comic Book / Strip; Fighting
661,Draftosaurus,2019,2,5,15,15,8,7.088,15926,1.25,661,26125,2764,170338,583,,1.13,990,1817,254,332,Animals; Prehistoric; Science Fiction
662,Archipelago,2012,2,5,30,240,14,7.271,8453,3.74,662,11008,3876,17874,655,,1.56,22,2471,329,689,Civilization; Economic; Exploration; Nautical; Negotiation; Renaissance
663,Space Empires 4X,2011,1,4,60,240,14,7.693,4056,3.35,663,7769,2560,9679,760,,1.52,40,1382,183,471,Bluffing; Civilization; Exploration; Science Fiction; Space Exploration; Wargame
664,Carcassonne: Hunters and Gatherers,2002,2,5,35,40,8,7.136,13517,1.92,664,18916,1504,49743,366,58,1.25,118,2475,386,250,Prehistoric; Territory Building
665,Azul: Queen's Garden,2021,2,4,45,60,10,7.454,5784,2.93,665,12775,1935,34874,405,44.99,1.4,316,826,103,182,Abstract Strategy; Puzzle; Renaissance
666,Unlock!: Escape Adventures,2017,2,6,45,75,10,7.339,6833,2.1,666,11355,1352,20806,215,,1.29,42,4111,280,156,Card Game; Puzzle
667,StarCraft: The Board Game,2007,2,6,180,240,12,7.36,7694,3.86,667,9698,2223,10950,652,,1.59,27,1915,240,449,Civilization; Miniatures; Science Fiction; Space Exploration; Territory Building; Video Game Theme; Wargame
668,Madeira,2013,2,4,60,150,12,7.533,4620,4.3,668,5613,1820,11918,327,,1.52,8,1367,115,431,Dice; Economic; Farming; Nautical
669,In the Hall of the Mountain King,2019,2,5,90,90,12,7.557,4867,2.84,669,8607,1715,11016,450,42.28,1.19,33,1216,223,233,Fantasy; Territory Building
670,Crusaders: Thy Will Be Done,2018,2,4,40,60,14,7.472,5062,2.47,670,6978,1355,17789,308,169.58,1.17,71,1064,164,277,Medieval; Territory Building
671,Taj Mahal,2000,2,5,45,90,14,7.256,8065,2.85,671,9962,1435,15574,178,,1.32,38,1816,329,386,Bluffing; Political
672,Tales of the Arabian Nights,2009,2,6,120,120,14,7.16,12916,2.15,672,18339,4036,23232,938,,1.65,19,3271,438,636,Adventure; Arabian; Exploration; Fantasy; Travel
673,Nexus Ops,2005,2,4,90,90,12,7.215,9175,2.23,673,11686,2336,21360,452,54.12,1.26,28,2354,466,418,Science Fiction; Wargame
674,Baseball Highlights: 2045,2015,1,4,45,45,9,7.522,4780,2.2,674,5986,1873,24714,447,,1.37,52,1232,181,423,Card Game; Science Fiction; Sports
675,Time's Up! Title Recall!,2008,4,18,60,60,12,7.681,3707,1.19,675,5354,1119,15821,93,19.95,1.52,21,577,133,122,Humor; Movies / TV / Radio theme; Party Game
676,Take 5,1994,2,10,45,45,8,6.98,31365,1.19,676,47524,2218,295052,709,13.5,1.28,1479,2342,361,258,Card Game; Number; Party Game
677,Weather Machine,2022,2,4,60,150,14,7.743,3803,4.56,677,8554,3141,11347,905,111.99,1.6,92,778,127,331,Environmental; Science Fiction
678,Creature Comforts,2022,1,5,45,45,8,7.443,6046,2.36,678,12294,3255,19914,922,49,1.28,129,1176,133,295,Animals
679,BulletÉ?ùã??,2021,1,4,10,20,13,7.615,4266,2.15,679,7379,1785,29639,437,49.99,1.33,188,868,93,287,Fighting; Puzzle; Real-time; Science Fiction
680,Queendomino,2017,2,4,25,25,8,7.144,11520,2.07,680,23018,1947,32014,412,27.89,1.16,58,2950,495,225,Fantasy; Medieval; Puzzle; Territory Building
681,War of the Ring: The Card Game,2022,2,4,90,120,13,7.643,4331,2.99,681,10125,2310,13412,722,38.78,1.45,157,788,143,247,Card Game; Fantasy; Novel-based
682,Project: ELITE,2020,1,6,60,60,14,7.943,2950,2.48,682,5309,2492,9371,408,,1.37,43,506,70,415,Fighting; Miniatures; Real-time; Science Fiction
683,Star Trek: Ascendancy,2016,3,3,180,180,14,7.806,3846,3.19,683,7188,1764,8569,630,,1.48,35,585,103,339,Civilization; Exploration; Miniatures; Movies / TV / Radio theme; Negotiation; Science Fiction; Space Exploration; Territory Building; Wargame
684,Dice Throne: Season One,2018,2,6,20,40,8,7.497,6369,2.07,684,8958,2000,23189,900,,1.49,65,1722,187,207,Card Game; Dice; Fantasy; Fighting
685,Pathfinder Adventure Card Game: Rise of the Runelords É?? Base Set,2013,1,4,90,90,13,7.163,12852,2.72,685,19338,2064,88300,1800,,1.59,24,4268,946,223,Adventure; Card Game; Fantasy; Fighting
